{
 "source": "https://www.visittrentino.info/it/guida/eventi?destination=&startdate=17%2F10%2F2019&enddate=31%2F10%2F2019&submitted=1#listview",
 "titles": [
  {
   "name": "La Collezione Cavallini Sgarbi",
   "date": "06/06/2019 - 03/11/2019",
   "location": "Località\nCaldes",
   "sub_title": "La Collezione Cavallini Sgarbi",
   "minidesc": "Da Niccolò dell'Arca a Francesco Hayez a cura di Vittorio Sgarbi",
   "dates": "Periodo\n06/06/2019 - 03/11/2019",
   "category": "Tipologia\nFeste e Sagre",
   "fulldesc": "Top Evento\nLa Collezione Cavallini Sgarbi\nDa Niccolò dell'Arca a Francesco Hayez a cura di Vittorio Sgarbi\n1 altre immagini\nPeriodo\n06/06/2019 - 03/11/2019\nLocalità\nCaldes\nTipologia\nFeste e Sagre\nDA NICCOLÒ DELL'ARCA A FRANCESCO HAYEZ\n80 CAPOLAVORI RIVELANO LA STORIA DI UNA INFINITA E APPASSIONANTE CACCIA AMOROSA\nUna collezione d'arte privata è la fondazione di un sistema simbolico, la creazione di una palestra per l’anima, un luogo dove si materializzano scelte intime, meditate e, talvolta, sofferte. Sovente si dimentica che la sua più alta vocazione sia quella di accogliere il pubblico, di offrirsi agli sguardi, di raccontare la propria storia.\nPer la Collezione Cavallini Sgarbi questo accadrà dal 6 giugno a Caldes, nel magnifico Castel Caldes, dentro un emozionante percorso lungo quattro secoli che, dalla seconda metà del Quattrocento, radunerà 80 opere della celebre collezione in una inedita selezione «Da Niccolò dell’Arca a Francesco Hayez». La mostra, realizzata in collaborazione con la Fondazione Cavallini Sgarbi, la Fondazione Elisabetta Sgarbi, e la direzione artistica di Contemplazioni, è organizzata dall'Azienda per il Turismo Val di Sole e promossa dalla Provincia Autonoma di Trento, dal Comune di Caldes, da Trentino Marketing e dalla Comunità della Val di Sole.\nAll’interno della mostra si respirerà l’atmosfera intima propria di una collezione privata, frutto dell’appassionata caccia amorosa di Vittorio Sgarbi, svolta in tandem con la madre Rina Cavallini, la quale ha acquistato le opere in numerose aste in ogni angolo del mondo. Il suo «miglior uomo», ricordata dal critico con queste parole: «si fece prolungamento del mio pensiero e della mia vita. Io indicavo il nome di un artista, il luogo, la casa d'aste. E lei puntuale prendeva la mira e colpiva».\nORARIO DI APERTURA\nOrario continuato da martedì a domenica 10.00-18.00\nTutti i venerdì di luglio e agosto 10.00-22.00\nENTRATA A PAGAMENTO\n€ 10,00 INGRESSO SINGOLO INTERO\n€ 8,00 INGRESSO SINGOLO RIDOTTO over 65, possessori Trentino Guest Card , gruppi di almeno 15 persone, soci o tesserati di soggetti pubblici o privati convenzionati con il Museo, biglietto cumulativo 5 sedi, guide turistiche munite di tesserino di abilitazione\n€ 6,00 INGRESSO SINGOLO RIDOTTO SPECIALE RAGAZZI ragazzi da 15 a 26 anni\nOMAGGIO insegnanti accompagnatori di scolaresche in visita al museo o accreditati presso il Museo (EDUCard), diversamente abili e loro accompagnatore, professionisti del settore Beni e attività culturali (Ministero e Soprintendenze) muniti di tessera di riconoscimento e altri soggetti, convenzionati; Guide turistiche nell'esercizio della loro professione, ragazzi fino a 14 anni di età"
  },
  {
   "name": "Cosmo cartoons",
   "date": "20/07/2019 - 14/06/2020",
   "location": "Località\nTrento",
   "sub_title": "Cosmo cartoons",
   "minidesc": "L’esplorazione dell’Universo tra scienza e cultura pop",
   "dates": "Periodo\n20/07/2019 - 14/06/2020",
   "category": "Tipologia\nEventi Culturali, Mostre",
   "fulldesc": "Top Evento\nCosmo cartoons\nL’esplorazione dell’Universo tra scienza e cultura pop\nPeriodo\n20/07/2019 - 14/06/2020\nLocalità\nTrento\nTipologia\nEventi Culturali, Mostre\nRomanzi, film, fumetti, videogiochi, da Giulio Verne a Interstellar: in quanti modi abbiamo raccontato l’esplorazione dell’universo? Per scoprirlo basta andare al Muse di Trento, il famoso museo di scienze naturali disegnato dall’architetto Renzo Piano nel quartiere Le Albere, a pochi minuti dal centro storico della città.\nFino al 16 giugno 2020 il Muse ospita la mostra “Cosmo Cartoons” che, attraverso un percorso immersivo e interattivo, racconta il lato “pop” della corsa allo spazio, senza dimenticare scienza e tecnologia.\nProtagonista della mostra è la fantascienza, con illustrazioni che vanno dai romanzi di Verne alle riviste americane degli anni Cinquanta e alle famose copertine della collana di fantascienza Urania. C’è poi il cinema, che sin dagli albori ha tratto grande ispirazione dall’esplorazione dello spazio: dal celebre “Viaggio nella Luna” di Georges Méliès (1902) ai recenti blocksbuster come “Gravity” (2013) e “Interstellar” (2014).\nGrande spazio è dato anche allo sbarco dell’Apollo 11 bel 1969, a cui è dedicata un’intera sezione della mostra. Non mancano poi i giochi e i videogiochi ispirati alla fantascienza.\nPunto di forza della mostra è la sua capacità di coinvolgere il pubblico che viene invitato a interagire con installazioni interattive e multimediali, postazioni audio e angoli lettura tematici, fino ad arrivare in una vera e propria area giochi per tutte le età.\nIl biglietto per la mostra è compreso nel biglietto d'ingresso al museo"
  },
  {
   "name": "Trekking lungo il Sentiero della Pace",
   "date": "27/06/2019 - 17/10/2019",
   "location": "Località\nTorbole sul Garda - Nago",
   "sub_title": "Trekking lungo il Sentiero della Pace",
   "minidesc": "Un trekking storico dove la bellezza del paesaggio fa da sfondo a uno dei luoghi più significativi della Grande Guerra",
   "dates": "Periodo\nAttenzione!\nL'evento ha già avuto luogo!",
   "category": "Tipologia\nVisite Guidate",
   "fulldesc": "Trekking lungo il Sentiero della Pace\nUn trekking storico dove la bellezza del paesaggio fa da sfondo a uno dei luoghi più significativi della Grande Guerra\nPeriodo\nAttenzione!\nL'evento ha già avuto luogo!\nLocalità\nTorbole sul Garda - Nago\nTipologia\nVisite Guidate\nUn trekking storico, un percorso senza tempo, sospeso tra passato e presente, dove la bellezza del paesaggio fa da sfondo a uno dei luoghi storicamente più significativi della Grande Guerra nella nostra area: Malga Zures. Si, perché l’esercito Austroungarico e quello Italiano qui si fronteggiavano a poche centinaia di metri di distanza.\nPer raggiungere la nostra meta, saliremo lungo la linea difensiva Austroungarica, dove le postazioni militari offrono oggi suggestivi scorci sul Lago di Garda.\nPercorso\nKm 7.5 – h 4 – dislivello ↑ m 565 ↓ m 565\nAttraversiamo il centro storico di Nago e ci dirigiamo verso i vigneti che lo circondano. Ci incamminiamo gradualmente lungo il sentiero SAT 601, un tratto del Sentiero della Pace, che sovrasta le pareti di arrampicata e, accompagnati dalle brezze del lago, visitiamo insieme le casermette, le gallerie, le postazioni da sparo e le trincee, che costituivano la complessa linea difensiva Austroungarica.. Raggiungiamo Malga Zures, che ci accoglie oggi con ampie radure soleggiate ma che nel 1915 ospitò una delle più cruente battaglie della zona durante la Prima Guerra Mondiale. Malga Zures restò sempre saldamente in mano all’esercito Austroungarico, ma le postazioni italiane erano poco oltre, a Doss Alt. E’ possibile visitare il piccolo cimitero militare nelle vicinanze, rimasto testimone delle violente battaglie.\nUna breve sosta prima di avviarci sulla via del ritorno. Torniamo a valle, questa volta lungo l’antica mulattiera (sentiero SAT 632), che ci permette di ammirare le imponenti falesie di Nago e la loro storia.\nPrenotazione\nPresso gli Uffici informazione Garda Trentino di Riva del Garda, Arco e Torbole sul Garda\noppure\nPrenota qui"
  },
  {
   "name": "Volti e storie - San Martino ai Campi 1969-2019",
   "date": "26/06/2019 - 18/10/2019",
   "location": "Località\nTenno",
   "sub_title": "Volti e storie - San Martino ai Campi 1969-2019",
   "minidesc": "Mostra fotografica che racconta la storia di 50 anni di ricerche archeologiche a San Martino",
   "dates": "Periodo\nAttenzione!\nL'evento ha già avuto luogo!",
   "category": "Tipologia\nMostre",
   "fulldesc": "Volti e storie - San Martino ai Campi 1969-2019\nMostra fotografica che racconta la storia di 50 anni di ricerche archeologiche a San Martino\nPeriodo\nAttenzione!\nL'evento ha già avuto luogo!\nLocalità\nTenno\nTipologia\nMostre\nA 50 anni dalla scoperta una rassegna di eventi per vivere e conoscere l'area archeologica di Monte San Martino ai Campi.\nVAI AL PROGRAMMA\nLuogo di culto di altura frequentato a partire dalla seconda età del Ferro, in particolare dal III secolo a.C., è uno dei più vasti e importanti siti archeologici del Trentino. La destinazione sacra dell'area continua nella successiva età romana, quando viene edificato un santuario, le cui vestigia sono ancora visibili. A poca distanza si sviluppa un villaggio, costruito probabilmente con finalità militari, successivo al luogo di culto. Infine, nel corso dell'alto medioevo, sulle rovine del villaggio sorge una chiesa, frequentata fino all'età moderna.\nUna selezione dei reperti rinvenuti nel sito è esposta nella sezione archeologica del MAG Museo Alto Garda a Riva del Garda (www.museoaltogarda.it).\nAltri reperti si trovano presso il Centro di Documentazione di Pranzo di Tenno, dove è possibile approfondire i molteplici aspetti che il sito presenta attraverso pannelli esplicativi e la proiezione di un video sulle ricerche.\nIl centro è visitabile su prenotazione (Associazione Culturale San Martino, tel. 349 4952623)."
  },
  {
   "name": "Ottobre a Teatro - Onesti se nasse… furbi se deventa",
   "date": "19/10/2019",
   "location": "Località\nRiva del Garda",
   "sub_title": "Ottobre a Teatro - Onesti se nasse… furbi se deventa",
   "minidesc": "Spettacolo di teatro amatoriale con Loredana Cont e la filodrammatica Nino Berti di Rovereto.",
   "dates": "Periodo\nAttenzione!\nL'evento ha già avuto luogo!",
   "category": "Tipologia\nTeatro/Danza",
   "fulldesc": "Ottobre a Teatro - Onesti se nasse… furbi se deventa\nSpettacolo di teatro amatoriale con Loredana Cont e la filodrammatica Nino Berti di Rovereto.\nPeriodo\nAttenzione!\nL'evento ha già avuto luogo!\nLocalità\nRiva del Garda\nTipologia\nTeatro/Danza\nSi tiene dal 28 settembre al 2 novembre sul palco della sala della Comunità in via Rosmini a Riva del Garda la 24ª edizione di «Ottobre a teatro», la fortunata rassegna amatoriale che quest’anno è organizzata dalla compagnia «I Sarcaioli». Prevendita al via venerdì 13 settembre.\nLa formula rimane quella apprezzata in tutti questi anni: sei recite che si svolgono nei sabati di ottobre (precisamente, dall’ultimo di settembre al primo di novembre), sempre con inizio alle ore 20.45, e che propongono una selezione dei più interessanti spettacoli delle filodrammatiche trentine. La tradizionale incursione fuori provincia, di norma in territorio veneto, quest’anno non c’è, ma si conta di ripristinarla presto.\nAncora invariato il costo sia del biglietto d'ingresso, 7 euro, sia dell'abbonamento alle sei serate, 35 euro. La rassegna ha il patrocinio del Comune di Riva del Garda, della Comunità di Valle Alto Garda e Ledro e di Cofas (Compagnie Filodrammatiche Associate), nonché il contributo della Cassa Rurale Alto Garda.\nProgramma:\nSabato 28 settembre: “Sei mesi dal paradis”-La Scena di Varignano\nSabato 5 ottobre: “Frottole mondiali” della Compagnia di Lizzana\nSabato 12 ottobre: “L’hotel del libero scambio” intepretato dalla “Gustavo Modena” di Mori.\nSabato 19 ottobre: “Onesti se nasse… furbi se deventa” Loredana Cont con la filodrammatica Nino Berti di Rovereto.\nSabato 26 ottobre: “Non dirmi che non sei felice”, tratta un tema particolare, il classico triangolo “lui, lei e l’altro”, e lo fa, in modo interessante e allo stesso tempo divertente, grazie anche alla bravura del Circolo culturale filodrammatico di Ischia.\nSabato 2 novembre: “Benvenuti a Baluk” della compagnia giovane di Nogaredo, “I Sottotesto”\nPrevendita degli abbonamenti:\nal bar Acli in piazza Cavour a Riva del Garda:\nvenerdì 13 settembre dalle ore 15 alle 18.30;\nsabato 14 settembre dalle ore 10 alle 11.30;\nPrevendita dei biglietti e degli abbonamenti:\nal bar Acli in piazza Cavour a Riva del Garda:\nvenerdì 20 settembre dalle ore 15 alle 16.30;\nsabato 21 settembre dalle ore 10 alle 11.30;\nVendita dei biglietti tutti i sabati all’entrata del teatro a partire da un’ora prima della recita, inoltre al bar Acli in piazza Cavour a Riva del Garda tutti i venerdì dalle 15 alle 18 e tutti i sabati dalle 10 alle 12.\nPer info: 338 6886442 (Daria)"
  },
  {
   "name": "Festa de la Golva",
   "date": "19/10/2019",
   "location": "Località\nPrimiero - Sagròn Mis",
   "sub_title": "Festa de la Golva",
   "minidesc": "Il saluto all'arrivo dei colori autunnali!",
   "dates": "Periodo\nAttenzione!\nL'evento ha già avuto luogo!",
   "category": "Tipologia\nFeste e Sagre, Folklore",
   "fulldesc": "Festa de la Golva\nIl saluto all'arrivo dei colori autunnali!\nPeriodo\nAttenzione!\nL'evento ha già avuto luogo!\nLocalità\nPrimiero - Sagròn Mis\nTipologia\nFeste e Sagre, Folklore\nCome ogni anno, a salutare l''arrivo dei colori autunnali la Pro Loco di Sagron Misproporrà la tradizionale Festa de la Golva: apericena a buffet e torneo di freccette.\nSagron, Circolo Pro Loco, ore 17.00"
  },
  {
   "name": "Torbole Night Run",
   "date": "19/10/2019",
   "location": "Località\nTorbole sul Garda - Nago",
   "sub_title": "Torbole Night Run",
   "minidesc": "Percorso di 11 km, gara non competitiva",
   "dates": "Periodo\nAttenzione!\nL'evento ha già avuto luogo!",
   "category": "Tipologia\nSport",
   "fulldesc": "Torbole Night Run\nPercorso di 11 km, gara non competitiva\n1 altre immagini\nPeriodo\nAttenzione!\nL'evento ha già avuto luogo!\nLocalità\nTorbole sul Garda - Nago\nTipologia\nSport"
  },
  {
   "name": "Informatici senza frontiere",
   "date": "17/10/2019 - 19/10/2019",
   "location": "Località\nRovereto",
   "sub_title": "Informatici senza frontiere",
   "minidesc": "Il festival dell'informatica al servizio del sociale",
   "dates": "Periodo\nAttenzione!\nL'evento ha già avuto luogo!",
   "category": "Tipologia\nConferenze/Congressi, Festival",
   "fulldesc": "Informatici senza frontiere\nIl festival dell'informatica al servizio del sociale\n1 altre immagini\nPeriodo\nAttenzione!\nL'evento ha già avuto luogo!\nLocalità\nRovereto\nTipologia\nConferenze/Congressi, Festival\nTre giorni di oltre 40 confronti, dibattiti, laboratori per discutere su come usare le nuove tecnologie in modo consapevole e scoprire le attività di Informatici Senza Frontiere.\nInformatici Senza Frontiere è una onlus che propone un nuovo uso della tecnologia: più intelligente, sostenibile e solidale. Offre il proprio tempo, le proprie competenze, esperienze e passioni informatiche per realizzare progetti no profit, privilegiando contesti di emarginazione e difficoltà e situazioni di emergenza, in Italia e nei Paesi in via di sviluppo. La manifestazione è anche un’opportunità per agire e riflettere su temi di carattere etico:\nla sicurezza\nl’educazione alla tecnologia\nl’informatica come strumento per superare le barriere\nla collaborazione fra isittuzioni e società\nLa tecnologia digitale è diventata ormai un mezzo imprescindibile nella vita quotidiana di ogni persona, tuttavia, la sua pervasività è tale che è sempre più importante imparare a usarla in modo consapevole. Il festival propone una serie di dibattiti sul potere sociale degli algoritmi e sull'intelligenza artificiale, vista dal punto di vista etico, ma anche come possibile strumento per contrastare il cyberbullismo. Al tempo stesso è necessario che l'educazione a un uso consapevole della tecnologia riguardi non solo i giovani, ma anche adulti e anziani: al festival verranno presentati sia progetti realizzati dalle scuole, sia iniziative in cui la tecnologia è stata usata per aiutare gli anziani a superare l'isolamento, creando connessioni, mantenendo legami con i familiari e favorendo l'integrazione sociale anche di chi non può muoversi da casa. La tecnologia è un potente strumento per aiutare le fasce di popolazione più svantaggiate: da anni ISF realizza progetti nei paesi in via di sviluppo e con persone disabili. A Rovereto si scoprirà come la robotica possa portare a un miglioramento della qualità della vita nei pazienti affetti da autismo, come gli strumenti compensativi digitali possano aiutare i ragazzi con difficoltà di apprendimento e la realtà virtuale e aumentata siano fondamentali per abbattere barriere fisiche o sociali. Infine è importante ricordare che per la diffusione di una cultura digitale inclusiva che benefici tutti è fondamentale la collaborazione fra istituzioni e società. Al festival si parlerà della Nuova Agenda Europea per la Cultura, di Educazione alla cittadinanza globale e dell'importanza di diffondere le competenze digitali per diventare un Paese sempre più competitivo, più etico e meno caratterizzato da una situazione di digital divide. Diversi anche i laboratori dedicati a ragazzi a partire dagli 8 anni, che spaziano dalla programmazione scratch, alle riflessioni sugli stereotipi, i pregiudizi, le discriminazioni e la violenza verbale nei confronti delle minoranze, con particolare attenzione agli hate speech diffusi attraverso web e social networks. I ragazzi potranno inoltre progettare i loro primi \"oggetti intelligenti\" usando micro-controllori di semplice utilizzo e scoprire come funzionano i robot. Scarica qui il programma dell’edizione 2019!"
  },
  {
   "name": "3° Concorso Nazionale per Cori Maschili \"Luigi Pigarelli\"",
   "date": "19/10/2019 - 20/10/2019",
   "location": "Località\nArco",
   "sub_title": "3° Concorso Nazionale per Cori Maschili \"Luigi Pigarelli\"",
   "minidesc": "In occasione del 140° anniversario della nascita di Luigi Pigarelli",
   "dates": "Periodo\nAttenzione!\nL'evento ha già avuto luogo!",
   "category": "Tipologia\nMusica",
   "fulldesc": "3° Concorso Nazionale per Cori Maschili \"Luigi Pigarelli\"\nIn occasione del 140° anniversario della nascita di Luigi Pigarelli\n\">\nPeriodo\nAttenzione!\nL'evento ha già avuto luogo!\nLocalità\nArco\nTipologia\nMusica\nCon l’obiettivo di promuovere il repertorio trentino per cori maschili, la Federazione Cori del Trentino in collaborazione con il Coro Castel sez. SAT di Arco organizza il 3° Concorso Nazionale per Cori Maschili “Luigi Pigarelli” che si terrà ad Arco dal 19 al 20 ottobre 2019.\nI 13 Cori ammessi al Concorso:\nCoro “Alpino Le Due Valli” di Alzano Lombardo (BG)\nCoro “Monte Vignol” di Avio (TN)\nCoro “CAI Belluno – Sintagma” di Belluno (BL)\nCoro “Tre Cime” di Cimone (TN)\nCoro “Cima d'Oro Valle di Ledro” di Ledro (TN)\nCoro “Monte Calisio” di Martignano (TN)\nCoro “Amizi de la montagna” di Meano (TN)\nCoro “CET - Canto e tradizione” di Milano (MI)\nCoro “San Romedio Anaunia” di Romeno (TN)\nCoro “Piramidi” di Segonzano (TN)\nCoro “Vocilassù” di Toano (RE)\nCoro \"Amici dell'Obante - Città di Valdagno” di Valdagno (VI)\nCoro “Cima Verde” di Vigo Cavedine (TN)\nPROGRAMMA"
  },
  {
   "name": "Festa del Marrone di Castione",
   "date": "19/10/2019 - 20/10/2019",
   "location": "Località\nBrentonico",
   "sub_title": "Festa del Marrone di Castione",
   "minidesc": "Castagne, vino e prodotti tipici: weekend goloso nel Parco Naturale Locale del Monte Baldo",
   "dates": "Periodo\nAttenzione!\nL'evento ha già avuto luogo!",
   "category": "Tipologia\nFeste e Sagre, Enogastronomia, Intrattenimento della Località",
   "fulldesc": "Festa del Marrone di Castione\nCastagne, vino e prodotti tipici: weekend goloso nel Parco Naturale Locale del Monte Baldo\n1 altre immagini\nPeriodo\nAttenzione!\nL'evento ha già avuto luogo!\nLocalità\nBrentonico\nTipologia\nFeste e Sagre, Enogastronomia, Intrattenimento della Località\nI Marroni di Castione sono i protagonisti indiscussi.\nLa Festa del Marrone di Castione è una ghiotta occasione per assaporare i marroni, assaggiare piatti tipici trentini, dolci, birra e liquori a base di castagne. Per il secondo anno il Parco Cesare Battisti di Brentonico farà da cornice alla festa, al contrario degli anni passati in cui si svolgeva nel borgo medievale di Castione. Il “parco Palù” è incantevole con i colori autunnali e perfetto per le famiglie: ampi spazi verdi, panchine e un divertentissimo parco giochi. In entrambe le giornate, sia a pranzo che a cena, i volontari dell’Associazione Tutela Marroni di Castione prepareranno presso il grande tendone i piatti della cucina tipica trentina, alcuni dei quali rivisitati con la regina del weekend di festa: la castagna. Oltre alle prelibatezze che potrai gustare sul Parco C.Battisti nei due giorni di Festa, gusta un menù a base di castagna in alcuni ristoranti dell’Altopiano… non resterai deluso! Che ne dici di una bella passeggiata alla scoperta dei castagneti di Castione? Il precorso di circa 4 km ti farà conoscere i segreti della coltivazione dei preziosi frutti autunnali, ammirare le piante secolari e gli intensi colori del bosco."
  },
  {
   "name": "Garda Trentino EMTB Adventure",
   "date": "18/10/2019 - 20/10/2019",
   "location": "Località\nTorbole sul Garda - Nago",
   "sub_title": "Garda Trentino EMTB Adventure",
   "minidesc": "Tre giorni dedicati al mondo delle due ruote con pedalata assistita per vivere il territorio del Garda Trentino a 360°",
   "dates": "Periodo\nAttenzione!\nL'evento ha già avuto luogo!",
   "category": "Tipologia\nSport",
   "fulldesc": "Garda Trentino EMTB Adventure\nTre giorni dedicati al mondo delle due ruote con pedalata assistita per vivere il territorio del Garda Trentino a 360°\n1 altre immagini\nPeriodo\nAttenzione!\nL'evento ha già avuto luogo!\nLocalità\nTorbole sul Garda - Nago\nTipologia\nSport\nIl Lago di Garda Trentino è il vero e proprio paradiso delle emtb e proprio qui appassionati e fan della pedalata assistita vivranno un evento top dedicato al mondo della mountain bike elettrica!\nAmanti delle mtb siate tutto orecchi perché anche nel 2019 vivrete l’emozione di un evento top level dedicato al mondo delle moutain bike elettriche nel luogo che più di tutti è vocato per questa attività outdoor: il Lago di Garda Trentino.\nStiamo parlando di EMTB Adventure dal 18 al 20 ottobre 2019.\nPRENOTA LA TUA VACANZA\nPRENOTA I TOUR GUIDATI"
  },
  {
   "name": "Cammina Tesino Autunno - Sulle orme dell'orso speleo",
   "date": "13/10/2019 - 20/10/2019",
   "location": "Località\nCastello Tesino",
   "sub_title": "Cammina Tesino Autunno - Sulle orme dell'orso speleo",
   "minidesc": "Domenica 13 ottobre e 20 ottobre Castello Tesino Ore 9",
   "dates": "Periodo\nAttenzione!\nL'evento ha già avuto luogo!",
   "category": "Tipologia\nSport, Altro",
   "fulldesc": "Cammina Tesino Autunno - Sulle orme dell'orso speleo\nDomenica 13 ottobre e 20 ottobre Castello Tesino Ore 9\nPeriodo\nAttenzione!\nL'evento ha già avuto luogo!\nLocalità\nCastello Tesino\nTipologia\nSport, Altro\nPERIODO DELL’ATTIVITA’:\n13 e 20 ottobre\nGIORNO E ORA DELL'ATTIVITÀ:\ndomenica ore 9\nLINGUE IN CUI È SVOLTA L'ATTIVITÀ:\nItaliano\nDESCRIZIONE ATTIVITÀ:\nsulle orme dell'orso speleo: la grotta delle Pale Rosse 15.000 anni fa\nIMPORTO DELL'ATTIVITÀ:\ngratuito\nNOTE:\n- il punto di ritrovo verrà comunicato al momento dell'iscrizione\n- tutte le uscite sono facili e si svolgono sul territorio di Castello Tesino\n- partenza ore 9 e rientro ore 13 circa\n- consigliato abbigliamento sportivo da montagna e scarponcini da trekking\n- prenotazione entro le 12.30 del giorno precedente\nINFO:\nAPT Valsugana, uff. di Castello Tesino\ntel. + 39 0461 727730"
  },
  {
   "name": "Castagnada Biana",
   "date": "18/10/2019 - 20/10/2019",
   "location": "Località\nAlbiano",
   "sub_title": "Castagnada Biana",
   "minidesc": "Festa autunnale dedicata ad uno dei prodotti caratteristici della Valle di Cembra: il marrone di Albiano.",
   "dates": "Periodo\nAttenzione!\nL'evento ha già avuto luogo!",
   "category": "Tipologia\nIntrattenimento della Località, Enogastronomia, Folklore, Mercati e mercatini",
   "fulldesc": "Castagnada Biana\nFesta autunnale dedicata ad uno dei prodotti caratteristici della Valle di Cembra: il marrone di Albiano.\n1 altre immagini\nPeriodo\nAttenzione!\nL'evento ha già avuto luogo!\nLocalità\nAlbiano\nTipologia\nIntrattenimento della Località, Enogastronomia, Folklore, Mercati e mercatini\nFesta autunnale dedicata ad uno dei prodotti caratteristici della Valle di Cembra: il marrone di Albiano, coltivato da tempo immemorabile e impiegato con grande versatilità nella cucina locale.\nLa manifestazione ricorda i tempi lontani in cui le donne di Albiano intrecciavano lunghe ghirlande, infilzando le castagne con l’ausilio di una cordicella e scendevano a Trento per venderle in occasioni particolari.\nPer tutte e tre le giornate, presso il teatro tenda riscaldato, in centro al paese, degustazioni e vendita di specialità gastronomiche a base di castagne e farina di castagne e ricca offerta gastronomica con caldarroste, castagnaccio, tronchetto di castagne, castagne con il rhum e cioccolato, moretti di castagne e marmellata di castagne, preparati secondo le ricette tradizionali dalle Donne di Albiano.\nInoltre, cucina tipica, musica, ballo, mercatini e animazione per grandi e piccini.\nOrganizza: Corpo Bandistico di Albiano.\nInfo: +39 0461 683110, www.visitpinecembra.it, infocembra@visitpinecembra.it, bandaalbiano@libero.it"
  },
  {
   "name": "Gli animali e i colori d'autunno",
   "date": "20/10/2019",
   "location": "Località\nPeio (Pejo)",
   "sub_title": "Gli animali e i colori d'autunno",
   "minidesc": "Escursione di intera giornata nella magia dei suoni e colori dell'autunno nel Parco Nazionale dello Stelvio",
   "dates": "Periodo\nAttenzione!\nL'evento ha già avuto luogo!",
   "category": "Tipologia\nVisite Guidate",
   "fulldesc": "Gli animali e i colori d'autunno\nEscursione di intera giornata nella magia dei suoni e colori dell'autunno nel Parco Nazionale dello Stelvio\nPeriodo\nAttenzione!\nL'evento ha già avuto luogo!\nLocalità\nPeio (Pejo)\nTipologia\nVisite Guidate\nImmergersi nei colori e nei rumori del bosco in autunno in Val di Peio, habitat naturale di moltissimi animali selvatici delle Alpi come i cervi, i camosci e l’aquila reale. Se poi siamo accompagnati dalla guida del Parco Nazionale dello Stelvio, Ivan Callovi , che ci svela i segreti di questi luoghi e dei suoi abitanti, lo stupore è assicurato.\nESCURSIONE DI INTERA GIORNATA\nnella magia dei suoni e dei colori dell’autunno\nAutunno in Val di Sole: i boschi si tingono di mille colori e sfumature, il clima è frizzante, i boschi offrono funghi, castagne, noci, la raccolta delle mele è cominciata e i cervi si prepararano per il periodo dell'accoppiamento. Si repira un'atmosfera naturale di serenità e quiete. L'appuntamento è in Val di Peio per DOMENICA 20 OTTOBRE 2019. Ti aspettiamo!\nPROGRAMMA\nNel pieno dello splendore autunnale il Parco dello Stelvio organizza un'escursione di intera giornata in Val di Peio per ammirare i colori e gli animali di questa meravigliosa stagione. Sarà certamente un'esperienza indimenticabile...\nRITROVO ORE 8.00\na Cogolo al centro visite del Parco (1.170 m) e partenza in auto per il parcheggio di Pontevecchio (1.730 m)\nESCURSIONE ORE 8.30\npartenza a piedi lungo il sentiero che conduce alla Malga Verdignana. Approfondiremo i temi legati al territorio del Parco Nazionale dello Stelvio e agli habitat che di volta in volta verranno attraversati. Arrivati nei pressi della Malga Verdignana (2.076 m) il bosco si apre e inizieranno le osservazioni faunistiche per un tratto di versante di circa 4,5 km (punto più in alto a 2.388 m)\nRIENTRO ORE 15.30\ncon un percorso ad anello si ritorna al parcheggio di Pontevecchio, da dove in auto si riparte per Cogolo (arrivo entro le ore 16.00)\nDISLIVELLO 558 m\nLUNGHEZZA 9,4 km\nDIFFICOLTÀ media\nABBIGLIAMENTO\nscarponi, pantaloni lunghi, pile o softshell, giacca a vento, guanti, berretto, occhiali da sole\nPRENOTAZIONI\nè possibile PRENOTARE ONLINE l'esperienza del bramito sul sito di Ambiente Trentino\nla partenza delle escursioni è soggetta al raggiungimento del numero minimo di 6 partecipanti\nQUOTA DI PARTECIPAZIONE\n€ 20,00 ADULTI\n€ 10,00 BAMBINI fino ai 12 anni non ancora compiuti\nincluso organizzazione, accompagnamento guidato da un esperto faunistico del Parco Nazionale dello Stelvio\nnon incluso bevande e pranzo al sacco\n​Si declina ogni responsabilità per eventuali danni a persone o cose, che dovessero verificarsi prima, durante e dopo lo svolgimento dell’escursione. In caso di forte maltempo annunciato l’esperienza verrà annullata e riproposta in altra data o rimborsata.\nMAGGIORI INFORMAZIONI\nAMBIENTE TRENTINO\nTel: (+39) 348 0176732\ninfo@ambientetrentino.it"
  },
  {
   "name": "Convegno Regionale FIAF",
   "date": "20/10/2019",
   "location": "Località\nTorbole sul Garda - Nago",
   "sub_title": "Convegno Regionale FIAF",
   "minidesc": "Convegno Regionale dei Circoli Fotografici del Trentino Alto Adige",
   "dates": "Periodo\nAttenzione!\nL'evento ha già avuto luogo!",
   "category": "Tipologia\nAltro",
   "fulldesc": "Convegno Regionale FIAF\nConvegno Regionale dei Circoli Fotografici del Trentino Alto Adige\nPeriodo\nAttenzione!\nL'evento ha già avuto luogo!\nLocalità\nTorbole sul Garda - Nago\nTipologia\nAltro\nIl Fotogramma, nel 20° anno della propria attività, organizza il Convegno Regionale dei Circoli Fotografici del Trentino Alto Adige, manifestazione dedicata a tutti gli appassionati, professionisti ed esperti di fotografia della Regione Trentino Alto Adige.\nIl convegno avrà al suo interno momenti didattici e di interesse culturale nonché spazi dedicati all’esposizione di progetti fotografici, con l’obiettivo di promuovere la fotografia sul territorio sia come disciplina artistica che come strumento visivo e di comunicazione. Sarà inoltre occasione di aggregazione e scambio tra le varie realtà fotografiche regionali con l’intento di creare collaborazione tra esse ai fini di promuovere e rendere la fotografia di maggior interesse per il vasto pubblico.\nLa manifestazione, organizzata dall’ Associazione Culturale Il Fotogramma con il patrocinio di FIAF (Federazione Italiana Associazioni Fotografiche) si terrà a Nago-Torbole (TN) il giorno 20 ottobre 2019 e si svilupperà presso il Teatro Comunale e le sale espositive e didattiche del Forte Superiore.\nPROGRAMMA\nMaggiori info su www.ilfotogramma.org"
  },
  {
   "name": "Lago di Garda Music Festival",
   "date": "17/10/2019 - 21/10/2019",
   "location": "Località\nRiva del Garda",
   "sub_title": "Lago di Garda Music Festival",
   "minidesc": "Festival internazionale di Cori e Orchestre",
   "dates": "Periodo\nAttenzione!\nL'evento ha già avuto luogo!",
   "category": "Tipologia\nMusica",
   "fulldesc": "Lago di Garda Music Festival\nFestival internazionale di Cori e Orchestre\n1 altre immagini\nPeriodo\nAttenzione!\nL'evento ha già avuto luogo!\nLocalità\nRiva del Garda\nTipologia\nMusica\nA chi lo osserva, il lago offre uno spettacolo di luci e colori naturali che lo rendono una località di villeggiatura unica in qualsiasi stagione dell’anno. Il Festival della musica del Lago di Garda è reso ancora più esclusivo dal fascino conferito dagli edifici e dagli imponenti palazzi che lo circondano. Questo scenario magico offre ai cori e alle orchestre di non professionisti la possibilità di vivere un evento turistico e musicale indimenticabile"
  },
  {
   "name": "Trekking alle trincee del Monte Corno",
   "date": "04/06/2019 - 22/10/2019",
   "location": "Località\nTorbole sul Garda - Nago",
   "sub_title": "Trekking alle trincee del Monte Corno",
   "minidesc": "Escursione di mezza giornata sulle tracce dei capitani",
   "dates": "Periodo\nAttenzione!\nL'evento ha già avuto luogo!",
   "category": "Tipologia\nVisite Guidate",
   "fulldesc": "Trekking alle trincee del Monte Corno\nEscursione di mezza giornata sulle tracce dei capitani\n1 altre immagini\nPeriodo\nAttenzione!\nL'evento ha già avuto luogo!\nLocalità\nTorbole sul Garda - Nago\nTipologia\nVisite Guidate\nVenite con noi sulle tracce della storia!\nDa Nago, pittoresco paesino sul Lago di Garda, risalendo le pendici del Monte Corno, avremo un vero paesaggio da cartolina. Immersi nel verde di una lecceta, percorriamo insieme il sistema difensivo dell’esercito Austro-Ungarico, perfettamente restaurato. Ma non solo: lungo il percorso avremo modo di osservare anche interessanti fenomeni geologici. Avete mai sentito parlare delle \"marmitte dei giganti\" (formazioni rocciose di origine glaciale)?\nPercorso\nKm 5.5 – h 3 – dislivello ↑450 m ↓450 m\nDa Nago (220 m) saliamo rapidamente verso la falesia del “Belvedere”, una delle pareti di arrampicata più note del Garda Trentino. Seguendo l’antico sentiero roccioso, in breve tempo ci addentriamo nella lecceta. Dal sentiero principale si diramano brevi deviazioni verso le marmitte dei giganti e le fuciliere. Raggiungiamo così il castagneto di Monte Corno (400 m) in circa 40 min e da qui proseguiamo verso “La Busa dei Capitani” (480 m), dove visitiamo le rovine della postazione di comando. Da qui, ha inizio il sentiero SAT 637, che conduce alla sovrastante loc. Tre Croci (580 m). Una breve sosta e una visita alle gallerie restaurate prima del rientro, che percorreremo su diverse tracce. Seguiremo poi nuovamente il sentiero SAT 637 verso Nago, chiudendo il giro ad anello.\nRitrovo: Parcheggio rotonda di Nago h. 8.30\nRientro: h. 12.30 ca\nPrenotazione\nPresso gli Uffici informazione Garda Trentino di Riva del Garda, Arco e Torbole sul Garda\noppure\nPrenota qui"
  },
  {
   "name": "Walking on Mart",
   "date": "27/06/2019 - 25/10/2019",
   "location": "Località\nRovereto",
   "sub_title": "Walking on Mart",
   "minidesc": "Una camminata musicale tra il museo e la città al chiaro di luna",
   "dates": "Periodo\nAttenzione!\nL'evento ha già avuto luogo!",
   "category": "Tipologia\nMostre, Musica, Visite Guidate",
   "fulldesc": "Walking on Mart\nUna camminata musicale tra il museo e la città al chiaro di luna\nPeriodo\nAttenzione!\nL'evento ha già avuto luogo!\nLocalità\nRovereto\nTipologia\nMostre, Musica, Visite Guidate\nUn’escursione notturna alla scoperta delle collezioni del Mart e degli angoli nascosti della città di Rovereto.\nAbbandona ogni certezza e perditi negli spazi del Mart fra le opere di rinomati artisti, per poi proseguire all’aperto al chiaro di luna alla scoperta di percorsi e prospettive che Rovereto ti saprà regalare. Ciò che ti occorre è semplice, un lettore mp3 e delle cuffie. Un’esperienza “musicambolica” notturna, da godere in solitudine in mezzo a tanti. A guidarti in questo viaggio, una selezione musicale ispirata all’itinerario realizzata appositamente per l’evento. Un evento organizzato da Ambiente Trentino in collaborazione con il Mart, Emanuele Quindici e l’Azienda per il Turismo Rovereto e Vallagarina. Calendario\nGiovedì 27 giugno\nVenerdì 25 ottobre\nInfo utili\nPrenotazione obbligatoria presso Ambiente Trentino.\nRitrovo alle ore 21.00 nella piazza di fronte al Mart in Corso Bettini, 43. In caso di forte pioggia l’attività sarà annullata e rimborsata.\nSi consiglia di indossare scarpe da trekking e abbigliamento adatto alle temperature serali.\nOgni partecipante dovrà avere un dispositivo per riprodurre file in formato mp3 con cuffie e verificare per tempo il corretto funzionamento e la carica della batteria. La musica sarà inviata via mail dall'organizzazione al momento dell'iscrizione. Dovrà essere scaricata con l'anticipo sufficiente a fare una prova, assicurandosi che la riproduzione del file avvenga in modo corretto."
  },
  {
   "name": "Chef a Teatro",
   "date": "25/10/2019",
   "location": "Località\nMoena",
   "sub_title": "Chef a Teatro",
   "minidesc": "Il ristorante sul palco",
   "dates": "Periodo\nAttenzione!\nL'evento ha già avuto luogo!",
   "category": "Tipologia\nEnogastronomia",
   "fulldesc": "Chef a Teatro\nIl ristorante sul palco\nPeriodo\nAttenzione!\nL'evento ha già avuto luogo!\nLocalità\nMoena\nTipologia\nEnogastronomia\nChef a Teatro propone un appuntamento speciale in Val di Fassa di show cooking, ospitato al Teatro Navalge di Moena. Il progetto benefico coinvolge i ragazzi di The Staff del Teatro Valle dei Laghi, giovani con disabilità che diventeranno aiuto cuochi e camerieri per la serata, cimentandosi così in una nuova, emozionante sfida. I ragazzi affiancheranno, in questa seconda edizione, Stefano Ghetta del ristorante L Chimpl di Tamion (Vigo), chef stellato, particolarmente apprezzato dalla critica gastronomica per l’originalità e la ricerca del dettaglio nei suoi piatti. La prenotazione è obbligatoria. Venerdì 25 ottobre alle ore 20.00. Biglietto unico 33,00 € (primo, secondo, dessert, vino)."
  },
  {
   "name": "Hockey su ghiaccio: Fassa Falcons vs. Vienna Capitals Silver",
   "date": "25/10/2019",
   "location": "Località\nCanazei",
   "sub_title": "Hockey su ghiaccio: Fassa Falcons vs. Vienna Capitals Silver",
   "minidesc": "Campionato di hockey su ghiaccio dell’Alps Hockey League",
   "dates": "Periodo\nAttenzione!\nL'evento ha già avuto luogo!",
   "category": "Tipologia\nSport",
   "fulldesc": "Hockey su ghiaccio: Fassa Falcons vs. Vienna Capitals Silver\nCampionato di hockey su ghiaccio dell’Alps Hockey League\nPeriodo\nAttenzione!\nL'evento ha già avuto luogo!\nLocalità\nCanazei\nTipologia\nSport\nSegui le partite in casa dei Fassa Falcons, la squadra di hockey su ghiaccio dell’Alps Hockey League. I campioni della Val di Fassa giocano contro l’HC Vienna Capitals Silver. Ingresso: adulti € 10; gratuito per i bambini. Inizio partita alle ore 20.30."
  },
  {
   "name": "Ottobre a Teatro - Non dirmi che non sei felice",
   "date": "26/10/2019",
   "location": "Località\nRiva del Garda",
   "sub_title": "Ottobre a Teatro - Non dirmi che non sei felice",
   "minidesc": "Spettacolo di teatro amatoriale con il Circolo culturale filodrammatico di Ischia",
   "dates": "Periodo\nAttenzione!\nL'evento ha già avuto luogo!",
   "category": "Tipologia\nTeatro/Danza",
   "fulldesc": "Ottobre a Teatro - Non dirmi che non sei felice\nSpettacolo di teatro amatoriale con il Circolo culturale filodrammatico di Ischia\nPeriodo\nAttenzione!\nL'evento ha già avuto luogo!\nLocalità\nRiva del Garda\nTipologia\nTeatro/Danza\nSi tiene dal 28 settembre al 2 novembre sul palco della sala della Comunità in via Rosmini a Riva del Garda la 24ª edizione di «Ottobre a teatro», la fortunata rassegna amatoriale che quest’anno è organizzata dalla compagnia «I Sarcaioli». Prevendita al via venerdì 13 settembre.\nLa formula rimane quella apprezzata in tutti questi anni: sei recite che si svolgono nei sabati di ottobre (precisamente, dall’ultimo di settembre al primo di novembre), sempre con inizio alle ore 20.45, e che propongono una selezione dei più interessanti spettacoli delle filodrammatiche trentine. La tradizionale incursione fuori provincia, di norma in territorio veneto, quest’anno non c’è, ma si conta di ripristinarla presto.\nAncora invariato il costo sia del biglietto d'ingresso, 7 euro, sia dell'abbonamento alle sei serate, 35 euro. La rassegna ha il patrocinio del Comune di Riva del Garda, della Comunità di Valle Alto Garda e Ledro e di Cofas (Compagnie Filodrammatiche Associate), nonché il contributo della Cassa Rurale Alto Garda.\nProgramma:\nSabato 28 settembre: “Sei mesi dal paradis”-La Scena di Varignano\nSabato 5 ottobre: “Frottole mondiali” della Compagnia di Lizzana\nSabato 12 ottobre: “L’hotel del libero scambio” intepretato dalla “Gustavo Modena” di Mori.\nSabato 19 ottobre: “Onesti se nasse… furbi se deventa” Loredana Cont con la filodrammatica Nino Berti di Rovereto.\nSabato 26 ottobre: “Non dirmi che non sei felice”, tratta un tema particolare, il classico triangolo “lui, lei e l’altro”, e lo fa, in modo interessante e allo stesso tempo divertente, grazie anche alla bravura del Circolo culturale filodrammatico di Ischia.\nSabato 2 novembre: “Benvenuti a Baluk” della compagnia giovane di Nogaredo, “I Sottotesto”\nPrevendita degli abbonamenti:\nal bar Acli in piazza Cavour a Riva del Garda:\nvenerdì 13 settembre dalle ore 15 alle 18.30;\nsabato 14 settembre dalle ore 10 alle 11.30;\nPrevendita dei biglietti e degli abbonamenti:\nal bar Acli in piazza Cavour a Riva del Garda:\nvenerdì 20 settembre dalle ore 15 alle 16.30;\nsabato 21 settembre dalle ore 10 alle 11.30;\nVendita dei biglietti tutti i sabati all’entrata del teatro a partire da un’ora prima della recita, inoltre al bar Acli in piazza Cavour a Riva del Garda tutti i venerdì dalle 15 alle 18 e tutti i sabati dalle 10 alle 12.\nPer info: 338 6886442 (Daria)"
  },
  {
   "name": "29er Eurocup",
   "date": "23/10/2019 - 26/10/2019",
   "location": "Località\nRiva del Garda",
   "sub_title": "29er Eurocup",
   "minidesc": "Tappa del circuito europeo di vela Classe 29er",
   "dates": "Periodo\nAttenzione!\nL'evento ha già avuto luogo!",
   "category": "Tipologia\nSport",
   "fulldesc": "29er Eurocup\nTappa del circuito europeo di vela Classe 29er\n2 altre immagini\nPeriodo\nAttenzione!\nL'evento ha già avuto luogo!\nLocalità\nRiva del Garda\nTipologia\nSport\nUn fine stagione sempre spumeggiante grazie agli skiff 29er, derive terrazzate propedeutiche all’olimpico 49er, che all’Eurocup di Riva del Garda sono sempre più numerose. Grande crescita tecnica di questa classe, che per alcuni giovani rappresenta l’alternativa al doppio 420, soprattutto per chi ricerca velocità e performance nella vela. Oltre 12 le nazioni presenti."
  },
  {
   "name": "Inanellamento scientifico degli uccelli al Passo Brocon",
   "date": "29/09/2019 - 26/10/2019",
   "location": "Località\nPasso Brocon",
   "sub_title": "Inanellamento scientifico degli uccelli al Passo Brocon",
   "minidesc": "Possibilità di ammirare gli uccelli durante la migrazione - Passo Brocon",
   "dates": "Periodo\nAttenzione!\nL'evento ha già avuto luogo!",
   "category": "Tipologia\nAltro, Intrattenimento della Località",
   "fulldesc": "Inanellamento scientifico degli uccelli al Passo Brocon\nPossibilità di ammirare gli uccelli durante la migrazione - Passo Brocon\nPeriodo\nAttenzione!\nL'evento ha già avuto luogo!\nLocalità\nPasso Brocon\nTipologia\nAltro, Intrattenimento della Località\nPer la migrazione degli uccelli, Il Passo del Brocon (nei comuni di Castello e Cinte Tesino) è uno dei più importanti valichi del Trentino.\nDal 1997 il Museo delle Scienze di Trento ha attivato una stazione di inanellamento a scopo scientifico, facente parte del Progetto Alpi, un programma pluriennale di ricerca coordinato dall' Istituto Superiore per la Protezione e la Ricerca Ambientale (ex INFS) e dallo stesso Museo e finalizzato allo studio delle migrazioni attraverso le Alpi.\nOgni anno, per un mese in autunno, vengono effettuati studi sulle migrazioni degli uccelli sul valico tramite la cattura e l'applicazione di un piccolo anello alla zampa del volatile.\nLe specie più viste sono il Pettirosso e la Balia nera, ma notevole è la presenza di altri uccelli altrove poco inanellati (Prispolone, Stiaccino, Culbianco, Pispola, Spioncello,...) e estremamente interessante il passaggio di alcuni rapaci notturni (Gufo comune, Civetta capogrosso, Assiolo, Civetta nana) e diurni (Albanella reale, Gheppio, Smeriglio, Astore e Sparviere).\nE' possibile assistere alle operazioni di inanellamento durante tutto il periodo, \"approfittando\" delle spiegazioni degli esperti del Muse - Museo delle Scienze.\nDal 29 settembre al 26 ottobre 2019\nOrario visite: 15.00 - 17.00\nÈ preferibile avvisare la stazione un giorno prima della visita\nL'attività è sospesa in caso di maltempo\nInfo:\nwww.facebook.com/AmicidelBrocon/\nfrancesca.rossi@muse.it\nTel 335 5461737 (Noselli Stefano)\nTel 338 1392804 (Rossi Francesca)"
  },
  {
   "name": "Hockey su ghiaccio: Fassa Falcons vs. EC Bregenzerwald",
   "date": "26/10/2019",
   "location": "Località\nCanazei",
   "sub_title": "Hockey su ghiaccio: Fassa Falcons vs. EC Bregenzerwald",
   "minidesc": "Campionato di hockey su ghiaccio dell’Alps Hockey League",
   "dates": "Periodo\nAttenzione!\nL'evento ha già avuto luogo!",
   "category": "Tipologia\nSport",
   "fulldesc": "Hockey su ghiaccio: Fassa Falcons vs. EC Bregenzerwald\nCampionato di hockey su ghiaccio dell’Alps Hockey League\nPeriodo\nAttenzione!\nL'evento ha già avuto luogo!\nLocalità\nCanazei\nTipologia\nSport\nSegui le partite in casa dei Fassa Falcons, la squadra di hockey su ghiaccio dell’Alps Hockey League. I campioni della Val di Fassa giocano contro l’EC Bregenzerwald. Ingresso: adulti € 10; gratuito per i bambini. Inizio partita alle ore 20.30."
  },
  {
   "name": "Autunno alla Haus von Prükk",
   "date": "26/10/2019",
   "location": "Località\nLuserna",
   "sub_title": "Autunno alla Haus von Prükk",
   "minidesc": "Il fascino antico della Haus von Prükk – casa tradizionale cimbra-, i colori dei boschi di Lusérn e l’atmosfera del foliage, il suono evocativo della lingua cimbra…. Si uniscono per dar vita ad una giornata veramente originale all’insegna di leggende, cultura e antiche tradizioni!",
   "dates": "Periodo\nAttenzione!\nL'evento ha già avuto luogo!",
   "category": "Tipologia\nEventi Culturali, Mostre, Visite Guidate, Folklore",
   "fulldesc": "Autunno alla Haus von Prükk\nIl fascino antico della Haus von Prükk – casa tradizionale cimbra-, i colori dei boschi di Lusérn e l’atmosfera del foliage, il suono evocativo della lingua cimbra…. Si uniscono per dar vita ad una giornata veramente originale all’insegna di leggende, cultura e antiche tradizioni!\n2 altre immagini\nPeriodo\nAttenzione!\nL'evento ha già avuto luogo!\nLocalità\nLuserna\nTipologia\nEventi Culturali, Mostre, Visite Guidate, Folklore\nA volte le pietre sanno raccontare delle storie magiche…se interpretate possono trasmettere emozioni che si fatica poi a dimenticare.\nL’autunno è ormai arrivato, i boschi si dipingono di mille colori e il freddo inizia a penetrare nei muri delle case. La natura inizia ad addormentarsi ma le pietre che compongono la storica Haus Von Prükk-casa tradizionale cimbra-continuano a sussurrare le antiche leggende di Lusérn e del popolo cimbro.\nLe leggende, la cultura e le tradizioni di un paese che resta vivo nei secoli si vestono di rosso e giallo e assumono un fascino ancora maggiore, si amplificano e si propagano come il calore della legna che arde nelle stufe delle case.\nLe porte della Haus Von Prükk si apriranno sabato 26 ottobre alle ore 9.30 permettendo a tutti di rivivere gli antichi riti cimbri.\nL’arte del tombolo, la poesia delle antiche leggende, l’odore della legna d’abete che arde ed il tepore del fuoco saranno i protagonisti di questo appuntamento.Sarà il centro di Documentazione di Lusérn ad animare e a far rivivere la Haus.\nNon mancheranno le deliziose focacce cimbre, preparate secondo le tradizioni della cucina cimbra da Chiara e Stefania dall’Agritur Galeno, prima di incamminarsi alle ore 11.00 lungo il Sentiero dell’Immaginario per vedere con i propri occhi quanto magica possa essere la natura nella stagione autunnale a Lusérn.\nFra mille colori e accompagnati dalla lettura della Fiaba della Frau Pertega si arriverà al Rifugio Malga Campo dove, grazie all’accoglienza di Daniele ed Elena, sarà possibile degustare salumi e formaggi tradizionali.\nIl rientro a Lusérn concluderà questo tuffo nella storia cimbra, arricchita dalla pura bellezza della natura che si addormenta per lasciare spazio al regno del ghiaccio e della neve.\nOvviamente sarà anche l’occasione per visitare il Centro di Documentazione e la mostra in corso “Fratello Lupo”.\nCosto € 15,00. Bambini fino a 5 anni (compiuti) € 7,00\nCome effettuare il pagamento:\nEffettua il bonifico della quota intera alle seguenti coordinate bancarie:\nAzienda per il Turismo Folgaria, Lavarone, Luserna\nBank: CASSA RURALE VALLAGARINA BCC\nIBAN: IT 94 A 08011 34820 000040015039\nBIC CODE: CCRTIT2T01A\nCausale: “Rif. Partecipazione “Autunno alla Haus” seguito dal tuo nome e cognome\nInvia la copia della contabile e i tuoi recapiti telefonici a info@alpecimbra.it"
  },
  {
   "name": "Olivia Trummer & Nicola Angelucci in concerto",
   "date": "26/10/2019",
   "location": "Località\nMoena",
   "sub_title": "Olivia Trummer & Nicola Angelucci in concerto",
   "minidesc": "Autunno in musica a La Grenz: cena, concerto e a seguire jam session",
   "dates": "Periodo\nAttenzione!\nL'evento ha già avuto luogo!",
   "category": "Tipologia\nMusica",
   "fulldesc": "Olivia Trummer & Nicola Angelucci in concerto\nAutunno in musica a La Grenz: cena, concerto e a seguire jam session\nPeriodo\nAttenzione!\nL'evento ha già avuto luogo!\nLocalità\nMoena\nTipologia\nMusica\nProgramma: tedesca di Stoccarda, Olivia Trummer si forma come pianista classica, ma completa la sua formazione oltreoceano diplomandosi in jazz alla Manhattan School of Music di New York. Da quel momento le sue dita hanno cominciato a volare sui tasti, per accompagnare la sua voce calda e cristallina. Entrata recentemente a far parte del gruppo \"Caipi\" di Kurt Rosenwinkel, la potremo ascoltare in trio, con un coinvolgente repertorio di composizioni originali, accompagnata da uno dei più interessanti ed apprezzati batteristi italiani.\nMusic band: Olivia Trummer (pianoforte, tastiere, voce), Nicola Angelucci (percussioni).\nProgramma:\napertura cucine alle ore 19.00 con uno sfizioso piatto autunnale, vino e castagne;\ninizio concerto alle ore 21.30;\na seguire jam session.\nIngresso gratuito, cena e consumazioni a pagamento."
  },
  {
   "name": "Maroni in festa",
   "date": "27/10/2019",
   "location": "Località\nDrena",
   "sub_title": "Maroni in festa",
   "minidesc": "Mostra Mercato, mercatino con prodotti tipici, degustazioni di maroni, musica e show!",
   "dates": "Periodo\nAttenzione!\nL'evento ha già avuto luogo!",
   "category": "Tipologia\nEnogastronomia",
   "fulldesc": "Maroni in festa\nMostra Mercato, mercatino con prodotti tipici, degustazioni di maroni, musica e show!\n2 altre immagini\nPeriodo\nAttenzione!\nL'evento ha già avuto luogo!\nLocalità\nDrena\nTipologia\nEnogastronomia\n49° MOSTRA MERCATO MARONI DI DRENA\nDOMENICA 20 OTTOBRE (RINVIATA A DOMENICA 27 OTTOBRE!!!!)\nOre 9.00: PASSEGGIANDO LUNGO IL CAMMINO DEI RICCI, passeggiata di 6 km e ristoro lungo il cammino dei ricci con naturalista. Ritrovo e partenza presso la sala polivalente del Comune di Drena. Minimo 8 persone (in caso di maltempo verrà annullata)\nOre 10.30: APERTURA MERCATINI con vendita maroni di Drena, prodotti tipici e degustazione enogastronomica nei menù proposti dalle associazioni locali\nOre 14.00: DEGUSTAZIONE MARONI COTTI alla brace\nOre 15.00: DIMOSTRAZIONE CINOFILA da parte del gruppo VO.CI.S cani da ricerca e soccorso\nOre 16.00: MR. LUCKY LO SCIROPPATO direttamente per voi dal Circo Paniko!\nDalle 13.00 alle 15.00 --- TEDDY PILCHARDS ---\nDalle 17.00 alle 19.00 --- ZERO MANTRA ---"
  },
  {
   "name": "Menu Garda Ottobre d'Oro",
   "date": "12/10/2019 - 27/10/2019",
   "location": "Località\nArco, Drena, Dro ...",
   "sub_title": "Menu Garda Ottobre d'Oro",
   "minidesc": "Il gusto dell'autunno nei Ristoranti del Garda Trentino aderenti all'iniziativa. Chiedi la brochure agli uffici info",
   "dates": "Periodo\nAttenzione!\nL'evento ha già avuto luogo!",
   "category": "Tipologia\nEnogastronomia",
   "fulldesc": "Menu Garda Ottobre d'Oro\nIl gusto dell'autunno nei Ristoranti del Garda Trentino aderenti all'iniziativa. Chiedi la brochure agli uffici info\n1 altre immagini\nPeriodo\nAttenzione!\nL'evento ha già avuto luogo!\nLocalità\nArco, Drena, Dro ...\nTipologia\nEnogastronomia\nIL GUSTO DELL'AUTUNNO\nGusta i sapori e i piatti della cucina locale realizzati dai nostri chef con prodotti tradizionali!\nI ristoranti aderenti all'iniziativa garantiscono una cucina casalinga e di qualità:\nVilletta Annessa Hotel Villa Miravalle - Riva del Garda\nRistorante Nuovo 900 - Riva del Garda\nRistorante Il Re della Busa - Riva del Garda\nRistorante La Dolce Vita c/o Hotel Campagnola – Riva del Garda\nAcetaia del Balsamico Trentino – Riva del Garda\nAntica Croce - Tenno\nOsteria Le servite - Arco\nRistorante Alla Lega – Arco\nHotel Ristorante Olivo – Arco\nRistorante Il Ritratto – Arco\nRistorante Pizzeria Piccola Dallas - Arco\nAqua Ristorante – Torbole sul Garda\nRistorante Alfio Bar Pizzeria – Dro\nRistorante tipico \"La Casina\" - Drena\nMettiti alla prova con i nostri prodotti e condividi la tua esperienza!\n#gardafood\nSCOPRI I NOSTRI MENU"
  },
  {
   "name": "Campionato Vela d'Altura Alto Garda",
   "date": "31/03/2019 - 27/10/2019",
   "location": "Località\nTorbole sul Garda - Nago, Riva del Garda",
   "sub_title": "Campionato Vela d'Altura Alto Garda",
   "minidesc": "La stagione d'altura sull'Alto Garda con la Fraglia Cup!",
   "dates": "Periodo\nAttenzione!\nL'evento ha già avuto luogo!",
   "category": "Tipologia\nSport",
   "fulldesc": "Campionato Vela d'Altura Alto Garda\nLa stagione d'altura sull'Alto Garda con la Fraglia Cup!\nPeriodo\nAttenzione!\nL'evento ha già avuto luogo!\nLocalità\nTorbole sul Garda - Nago, Riva del Garda\nTipologia\nSport"
  },
  {
   "name": "FORMAI DAL MONT",
   "date": "26/10/2019 - 27/10/2019",
   "location": "Località\nTassullo",
   "sub_title": "FORMAI DAL MONT",
   "minidesc": "Rassegna dei migliori formaggi di malga della Val di Non e della Val di Sole",
   "dates": "Periodo\nAttenzione!\nL'evento ha già avuto luogo!",
   "category": "Tipologia\nEnogastronomia, Intrattenimento della Località",
   "fulldesc": "FORMAI DAL MONT\nRassegna dei migliori formaggi di malga della Val di Non e della Val di Sole\n1 altre immagini\nPeriodo\nAttenzione!\nL'evento ha già avuto luogo!\nLocalità\nTassullo\nTipologia\nEnogastronomia, Intrattenimento della Località\nSabato 26 e domenica 27 ottobre a Tassullo torna “Formai dal Mont” la rassegna dei migliori formaggi di malga della Val di Non e della Val di Sole.\nDodicesima edizione della rassegna dei formaggi di malga della Val di Non, Val di Sole e Altopiano della Paganella nata dall’idea di far conoscere ai giovani “mestieri e arti” dei nostri nonni. La rassegna prevede la valutazione, da parte di giudici qualificati, di formaggi freschi e stagionati di latte vaccino e latte caprino prodotti in malga. Si potranno assaggiare e votare i formaggi dando una propria valutazione.\nQuest’anno per la prima volta si potranno assaggiare i formaggi caprini e sarete voi a votare il miglior formaggio. Inoltre un’altra novità sarà il concorso del miglior formaggio votato dai bambini. Durante tutto il pomeriggio ci saranno tante attività legate al latte e al formaggio per tutti i bambini organizzate dalla F. Mach. Possibilità di vedere la fattoria didattica. Potrai acquistare i migliori prodotti del Trentino e i formaggi di malga direttamente dai produttori.\nInfo: Pro loco Tassullo tel. 339 2496495 – info@prolocotassullo.it"
  },
  {
   "name": "Festa della Castagna",
   "date": "26/10/2019 - 27/10/2019",
   "location": "Località\nRoncegno Terme",
   "sub_title": "Festa della Castagna",
   "minidesc": "Vie del centro",
   "dates": "Periodo\nAttenzione!\nL'evento ha già avuto luogo!",
   "category": "Tipologia\nFeste e Sagre, Enogastronomia, Mercati e mercatini",
   "fulldesc": "Festa della Castagna\nVie del centro\nPeriodo\nAttenzione!\nL'evento ha già avuto luogo!\nLocalità\nRoncegno Terme\nTipologia\nFeste e Sagre, Enogastronomia, Mercati e mercatini\n26 e 27 ottobre 2019, dalle ore 10.00 alle ore 19.00\nLa regina dei prodotti autunnali si presenta a Roncegno Terme dal 26 al 27 ottobre alla Festa della Castagna.\nVieni a scoprire il profumo, il gusto, le curiosità di questo frutto: Specialità gastronomiche a base di castagne e vin brulé, mercatino dei prodotti e tanta musica per festeggiare l'antichissima tradizione della coltivazione della castagna...\nProgramma:\nSabato 26 ottobre\nDalle ore 10 - Il mercatino della castagna per le vie del centro\nOre 10 - Escursione a piedi tra i castagni secolari, passando per i caratteristici masi di montagna. Ritrovo in Piazza Municipio presso l'ufficio APT, iscrizioni entro venerdì pomeriggio tel. 0461 727700\nOre 14.30 - Artbus - laboratorio artistico per bambini e caricature dal vivo\nDalle ore 16 - Musica con il Gruppo Alibi, Piazza Montebello\nOre 20.45 - Concerto Coro Sant'Osvaldo di Roncegno, Casa di Salute Raphael\nDomenica 27 ottobre\nDalle ore 9 - Mercatino della castagna per le vie del centro\nOre 10 - Escursione a piedi tra i castagni secolari, passando per i caratteristici masi di montagna. Ritrovo in Piazza Municipio presso l'ufficio APT, iscrizioni entro venerdì pomeriggio tel. 0461 727700\nDalle ore 10.30 - Artbus - laboratorio artistico per bambini - Caricature dal vivo - Truccabimbi in Piazza Municipio\nDalle ore 10.30 alle ore 12 - Costruiamo un piccolo orso - laboratorio di falegnameria per bambini con AmBios\nDalle 13.30 alle 18.30 - Musica dal vivo con il Duo Euphonia, Piazza Montebello\nOre 14 - Esibizione del Gruppo Folk Palaerlearmusikantn, Piazza Municipio\nDalle ore 15 alle ore 18 - Esibizione di danza in costumi tradizionali ottocenteschi, Casa di Salute Raphael\nOre 16 - Spettacolo teatrale \"Gli amici di Peter\", Teatro Parrocchiale\nIn entrambe le giornate\nTutto il giorno:\ngli animali della fattoria, Piazza Municipio\npasseggiate con pony nei Giardini di Piazza Montebello\nla ferita di Vaia Sella e oltre, mostra fotografica, atrio del Municipio\nDalle 10 alle 18:\nsi potrà visitare il Museo degli Strumenti Musicali Popolari presso la Chiesetta di Santa Brigida\ne il Museo Casa degli Spaventapasseri a Marter, orario 10-12 e 14.30-17.30\nScarica il programma\nSCOPRI DI PIÙ\nRoncegno Terme, centro termale rinomato fin dall'800 -> scopri la località\nLa strada del castagno -> scarica la cartina\nIl Biotopo Palude di Roncegno -> scopri l'area naturalistica\nPer ulteriori informazioni:\nComune di Roncegno Terme: tel. 0461 764061\nAPT Valsugana ufficio di Levico Terme: tel. 0461 727700\nEvento realizzato in collaborazione con le tutte le Associazioni di Roncegno Terme"
  },
  {
   "name": "42^ Esposizione Ornitologica Trentina",
   "date": "26/10/2019 - 27/10/2019",
   "location": "Località\nRiva del Garda",
   "sub_title": "42^ Esposizione Ornitologica Trentina",
   "minidesc": "Concorso dedicato all'indigeno ancestrale e mutato \"delle Dolomiti\", mercatino antichi mestieri e intrattenimento",
   "dates": "Periodo\nAttenzione!\nL'evento ha già avuto luogo!",
   "category": "Tipologia\nAltro",
   "fulldesc": "42^ Esposizione Ornitologica Trentina\nConcorso dedicato all'indigeno ancestrale e mutato \"delle Dolomiti\", mercatino antichi mestieri e intrattenimento\nPeriodo\nAttenzione!\nL'evento ha già avuto luogo!\nLocalità\nRiva del Garda\nTipologia\nAltro\nX° CONCORSO DEDICATO ALL'INDIGENO ANCESTRALE E MUTATO \" DELLE DOLOMITI\"\nMercatino creativo e degustazione di formaggi\nPresenza scuola Provinciale cani da ricerca e Catastrofe onlus (Trento)\nServizio bar all’interno\nMANIFESTAZIONE ORGANIZZATA DALL’ASSOCIAZIONE ORNITOLOGICA TRENTINA\ncon il contributo concesso dalla Provincia Autonoma di Trento"
  },
  {
   "name": "FESTA DELLA PATATA 2019",
   "date": "25/10/2019 - 27/10/2019",
   "location": "Località\nComano Terme",
   "sub_title": "FESTA DELLA PATATA 2019",
   "minidesc": "La sagra sotto i vòlti.",
   "dates": "Periodo\nAttenzione!\nL'evento ha già avuto luogo!",
   "category": "Tipologia\nEnogastronomia",
   "fulldesc": "FESTA DELLA PATATA 2019\nLa sagra sotto i vòlti.\n1 altre immagini\nPeriodo\nAttenzione!\nL'evento ha già avuto luogo!\nLocalità\nComano Terme\nTipologia\nEnogastronomia\nUna sagra dedicata alla patata di montagna, La Montagnina, questo il nome, è coltivata esclusivamente su terreni e in ambiente di montagna, tra i 600 e 900 metri, secondo un protocollo di autodisciplina dei coltivatori trentini.\nFesta della Patata dal 25 al 27 ottobre, la Montagnina viene celebrata con gustosi piatti, dall’antipasto al dolce, frutto della maestria e della creatività degli chef.\nInoltre per tutto il weekend ci sarà un mercatino dove acquistare i diversi tipi di patata coltivati in questa terra unica e visite guidate alla COPAG, la cooperativa degli produttori giudicariesi, laboratori e stand gastronomici.\nScarica il programma completo.\nPer informazioni\nAzienda per il Turismo Terme di Comano Dolomiti di Brenta\nvia C. Battisti, 74 - 38077 Comano Terme (TN)\ntel. 0465 702626 - info@visitacomano.it - www.visitacomano.it"
  },
  {
   "name": "Escursione a piedi a Bosco Caproni",
   "date": "20/06/2019 - 27/10/2019",
   "location": "Località\nArco",
   "sub_title": "Escursione a piedi a Bosco Caproni",
   "minidesc": "Un facile trekking, ideale per famiglie, sportivi e amanti della storia e della natura",
   "dates": "Periodo\nAttenzione!\nL'evento ha già avuto luogo!",
   "category": "Tipologia\nVisite Guidate",
   "fulldesc": "Escursione a piedi a Bosco Caproni\nUn facile trekking, ideale per famiglie, sportivi e amanti della storia e della natura\n1 altre immagini\nPeriodo\nAttenzione!\nL'evento ha già avuto luogo!\nLocalità\nArco\nTipologia\nVisite Guidate\nVoi sapete che poco distante dal centro storico di Arco c’è un bosco?\nVi proponiamo un viaggio nel tempo del XX secolo sullo sfondo di un paesaggio incontaminato: un facile trekking, di durata 3-4 ore, ideale per famiglie, sportivi e amanti della storia e della natura, che cercano un’occasione per trascorrere una mattinata divertente e ricca di nuove esperienze. Il bosco si trova su un piccolo terrazzo glaciale, che racchiude al suo interno una moltitudine di storie e segreti, alcune delle quali antichissime. Molte di queste sono legate proprio alla roccia.\nPercorso\nKm 8 – 3-4 ore – ↑360 m ↓360 m\nDurante questa bellissima passeggiata partiremo insieme da Arco e, oltrepassata l'olivaia di S. Martino, osserveremo col naso all’insù gli scalatori sulle pareti strapiombanti della storica falesia di Massone Policromuro, uno dei più famosi siti per l’arrampicata di Arco. Risaliremo ai piedi delle falesie per scoprire le cave di oolite, una roccia morbida e facile da lavorare per gli scultori, che realizzarono opere su pietra fino all'inizio del XX secolo. Eccoci giunti dentro il bosco Caproni. E’ un bosco di lecci (querce mediterranee), uno dei pochi collocati a queste latitudini, grazie al clima mite e ai venti del Lago di Garda. Qui troviamo le cave di oolite più grandi e affascinanti, potremo visitarle all’interno e poi partire alla scoperta del “dorso di balena” e delle trincee della Prima Guerra Mondiale. Il panorama sulla valle del Sarca con le sue pareti di roccia aggettanti e le rovine delle case minerarie faranno da contorno al nostro tour!\nPrenotazione\nPresso gli Uffici informazione Garda Trentino di Riva del Garda, Arco e Torbole sul Garda\noppure\nPrenota qui"
  },
  {
   "name": "1° Memorial Aurelio Leoni",
   "date": "27/10/2019",
   "location": "Località\nDro",
   "sub_title": "1° Memorial Aurelio Leoni",
   "minidesc": "Corsa non competitiva di 5 km. Il percorso si snoderà lungo le vie di Dro e Ceniga",
   "dates": "Periodo\nAttenzione!\nL'evento ha già avuto luogo!",
   "category": "Tipologia\nSport",
   "fulldesc": "1° Memorial Aurelio Leoni\nCorsa non competitiva di 5 km. Il percorso si snoderà lungo le vie di Dro e Ceniga\nPeriodo\nAttenzione!\nL'evento ha già avuto luogo!\nLocalità\nDro\nTipologia\nSport\nPROGRAMMA e ORARI:\n- Ritrovo e consegna pettorali dalle ore 9:00 alle 10:30\npresso l’Oratorio di Dro in Via Cesare Battisti n°2.\n- Partenza ore 11:00.\n- Al termine della corsa Pasta Party per tutti i partecipanti.\nISCRIZIONE:\n- € 5,00 fino alle 24:00 del 26 ottobre, iscrizione online al link:\nwww.avaibooksports.com/inscripcion/inscripcion_datos.php?id=9861\n- € 7,00 il giorno della gara, dalle 9:00 alle 10:30.\nPREMIAZIONI:\nSaranno premiati i primi 3 classificati assoluti (M, F).\nIn oltre verranno premiati i primi 3 classificati (M, F) per la categoria “anno 1957”.\nUn riconoscimento anche per il gruppo più numeroso.\n________________\nL’evento avrà luogo con qualsiasi condizione atmosferica.\nL'organizzazione si riserva il diritto di apportare modifiche al percorso se lo si riterrà opportuno.\nPer informazioni:\nTel. 340 5037701 / 340 6811857 / 0464 510346"
  },
  {
   "name": "Olio che bontà",
   "date": "26/10/2019 - 27/10/2019",
   "location": "Località\nTorbole sul Garda - Nago",
   "sub_title": "Olio che bontà",
   "minidesc": "Assaggio olio di prima spremitura dei produttori di Nago-Torbole con esperti assaggiatori",
   "dates": "Periodo\nAttenzione!\nL'evento ha già avuto luogo!",
   "category": "Tipologia\nEnogastronomia",
   "fulldesc": "Olio che bontà\nAssaggio olio di prima spremitura dei produttori di Nago-Torbole con esperti assaggiatori\nPeriodo\nAttenzione!\nL'evento ha già avuto luogo!\nLocalità\nTorbole sul Garda - Nago\nTipologia\nEnogastronomia\nDalle 13.00 presso la casa del Dazio nel piccolo porticciolo di Torbole verrà allestita una casetta per assaggiare insieme a esperti degustatori le qualità e i sapori degli oli di oliva extravergine di prima spremitura dei produttori locali."
  },
  {
   "name": "Nago in movimento",
   "date": "27/10/2019",
   "location": "Località\nTorbole sul Garda - Nago",
   "sub_title": "Nago in movimento",
   "minidesc": "Quiz da risolvere e fotografie da riconoscere. Attività per bimbi e famiglie",
   "dates": "Periodo\nAttenzione!\nL'evento ha già avuto luogo!",
   "category": "Tipologia\nAltro",
   "fulldesc": "Nago in movimento\nQuiz da risolvere e fotografie da riconoscere. Attività per bimbi e famiglie\nPeriodo\nAttenzione!\nL'evento ha già avuto luogo!\nLocalità\nTorbole sul Garda - Nago\nTipologia\nAltro\nNago sarà animata da \"Nago in movimento\", manifestazione di orientamento culturale non competitiva con Quiz da risolvere e fotografie da riconoscere.\nOre 13.30 ritrovo presso l'Oratorio di Nago e iscrizione sul posto fino alle 14.20 con istruzioni sulle regole base dell'orientamento\nOre 14.30 partenza dei partecipanti\nOre 16.30 Estrazione premi e chiusura evento. Ristoro per tutti e premi a sorteggio!\nQuota di iscrizione: 3 Euro a persona\nPercorso culturale guidato per bambini e famiglie; percorso in autonomia dai 9 anni."
  },
  {
   "name": "Armate in Miniatura",
   "date": "20/04/2019 - 30/10/2019",
   "location": "Località\nTorbole sul Garda - Nago",
   "sub_title": "Armate in Miniatura",
   "minidesc": "Collezioni del Museo della Guerra di Rovereto",
   "dates": "Periodo\n20/04/2019 - 30/10/2019",
   "category": "Tipologia\nMostre",
   "fulldesc": "Armate in Miniatura\nCollezioni del Museo della Guerra di Rovereto\nPeriodo\n20/04/2019 - 30/10/2019\nLocalità\nTorbole sul Garda - Nago\nTipologia\nMostre\nIl biglietto della mostra dà diritto alla riduzione sull’ingresso al Museo della Guerra di Rovereto (6 euro anziché 7,50) e sulla partecipazione alle visite guidate in città promosse da Apt Rovereto e Vallagarina (ogni due partecipanti con biglietto d’ingresso alla mostra una visita guidata è in omaggio).\nLa mostra, ospitata negli spazi dell’ex colonia Pavese a Torbole sul Garda, racconta i diversi impieghi dei modelli nel settore militare, attraverso oggetti e documenti provenienti dalle collezioni del Museo della Guerra di Rovereto, con importanti prestiti da parte di associazioni e privati. In primo piano il rilievo culturale del modellare, che esce dal contesto tecnico ed entra in quello del gioco e del tempo libero.\nFin dall’antichità la riproduzione in scala di oggetti ha fatto parte della vita quotidiana. Questa pratica si trasforma col tempo: da oggetti devozionali impiegati in sepolture o come ex voto, a modelli per manufatti sempre più complessi.\nPrima dell’era digitale, la riproduzione in scala dei campi di battaglia è stato un importante strumento per definire tattiche e strategie militari. I modelli servivano come prototipi per realizzare mezzi militari ma anche sculture o monumenti commemorativi.\nIn epoca coloniale, i plastici che riproducevano i paesaggi delle lontane terre di conquista, alimentarono un nuovo gusto esotico nella popolazione civile. Il modellismo, nella sua accezione più vasta, diventa infine nel XX secolo il mezzo con cui si ricostruiscono in scala eventi storici ritenuti significativi. Solo negli ultimi decenni il modello si trasforma anche in oggetto da collezione e di gioco.\nIl percorso espositivo ripercorre questi diversi aspetti offrendo uno scorcio sull’evoluzione del modellismo militare attraverso modelli, diorami e figurini. Il progetto si arricchisce grazie alla collaborazione con numerosi enti e associazioni attivi in ambito modellistico e collezionistico che nel periodo di apertura della mostra proporranno attività ed eventi collegati.\nLOCANDINA"
  },
  {
   "name": "Armate in miniatura",
   "date": "20/04/2019 - 30/10/2019",
   "location": "Località\nRovereto",
   "sub_title": "Armate in miniatura",
   "minidesc": "L'evoluzione del modellismo militare",
   "dates": "Periodo\n20/04/2019 - 30/10/2019",
   "category": "Tipologia\nMostre",
   "fulldesc": "Armate in miniatura\nL'evoluzione del modellismo militare\n2 altre immagini\nPeriodo\n20/04/2019 - 30/10/2019\nLocalità\nRovereto\nTipologia\nMostre\nIl modellismo come strumento di tattiche militari, come testimonianza di guerra ed infine come oggetto da collezione e da gioco.\nLa mostra, ospitata negli spazi dell'ex colonia Pavese a Torbole sul Garda, racconta i diversi impieghi dei modelli nel settore militare, attraverso oggetti e documenti provenienti dalle collezioni del Museo Storico Italiano della Guerra di Rovereto, con importanti prestiti da parte di associazioni e privati. Fin dall'antichità la riproduzione in scala di oggetti ha fatto parte della vita quotidiana. Questa pratica si trasforma col tempo: da oggetti devozionali impiegati in sepolture o come ex voto, a modelli per manufatti sempre più complessi. Prima dell'era digitale, la riproduzione in scala dei campi di battaglia è stato un importante strumento per definire tattiche e strategie militari. I modelli servivano come prototipi per realizzare mezzi militari ma anche sculture o monumenti commemorativi. In epoca coloniale, i plastici che riproducevano i paesaggi delle lontane terre di conquista, alimentarono un nuovo gusto esotico nella popolazione civile. Il modellismo, nella sua accezione più vasta, diventa infine nel XX secolo il mezzo con cui si ricostruiscono in scala eventi storici ritenuti significativi. Solo negli ultimi decenni il modello si trasforma anche in oggetto da collezione e di gioco. Il percorso espositivo ripercorre questi diversi aspetti offrendo uno scorcio sull'evoluzione del modellismo militare attraverso modelli, diorami e figurini. Il progetto si arricchisce grazie alla collaborazione con numerosi enti e associazioni attivi in ambito modellistico e collezionistico che nel periodo di apertura della mostra proporranno attività ed eventi collegati. Una mostra in collaborazione con la Provincia autonoma di Trento, il Comune di Nago Torbole, i Bim dell'Adige, l’Associazione Culturale Benàch, l’Associazione Raggruppamento SPA, il Comitato ricostruzione carro armato Fiat 2000, Dolomites Bricks, la Federazione Italiana Flames of War, GAR Gruppo Aeromodellisti Rovereto, G.M.T. Gruppo Modellistico Trentino di studio e ricerca storica, Your Command!, l’Azienda per il Turismo Rovereto e Vallagarina, l’Azienda per il Turismo Garda Trentino, l’Azienda agricola Madonna della Vittorie e la Distilleria Marzadro."
  },
  {
   "name": "DiVin Ottobre",
   "date": "04/10/2019 - 31/10/2019",
   "location": "Località\nGrumes, Riva del Garda, Isera ...",
   "sub_title": "DiVin Ottobre",
   "minidesc": "Un viaggio di gusto tra colori e sapori d'autunno",
   "dates": "Periodo\n04/10/2019 - 31/10/2019",
   "category": "Tipologia\nEnogastronomia, Intrattenimento della Località",
   "fulldesc": "DiVin Ottobre\nUn viaggio di gusto tra colori e sapori d'autunno\n2 altre immagini\nPeriodo\n04/10/2019 - 31/10/2019\nLocalità\nGrumes, Riva del Garda, Isera ...\nTipologia\nEnogastronomia, Intrattenimento della Località\nTrentino, i fine settimana di ottobre 2019\nIn Trentino accogliamo l’arrivo dell’autunno con DiVin Ottobre, ricco calendario di appuntamenti, in programma in tutti i weekend del mese lungo la Strada del Vino e dei Sapori del Trentino.\nUn’occasione per scoprire i paesaggi più suggestivi attraverso un viaggio di gusto che coinvolge cantine, aziende agricole, ristoranti ed agriturismi. Tante le iniziative in programma: da trekking guidati in boschi o vigneti a cooking show, da aperitivi gourmet a degustazioni in cantina, ma anche feste dedicate ai prodotti più caratteristici del periodo. Il tutto dominato dai caldi colori autunnali che rendono magico il paesaggio.\nEcco dunque la rassegna da non perdere che vi farà “assaporare” il Trentino!\nClicca qui (link) per sfogliare la brochure di DiVin Ottobre 2019\nIl programma\nda venerdì 4 a domenica 6 ottobre\nEcofiera di montagna\nTione di Trento\nda venerdì 4 a domenica 6 ottobre\nFestival della polenta\nStoro\nsabato 5 ottobre\nEnotrekking “Bollicine dell'Argentario”\nTrento\ndomenica 6 ottobre\nFesta del radicchio di Bieno\nBieno\n----\nda giovedì 10 a domenica 13 ottobre\nLa Vigna Eccellente. Ed è subito Isera\nIsera\nda venerdì 11 a domenica 13 ottobre\nFesta della zucca ... miele e delle castagne\nPergine Valsugana\nsabato 12 e domenica 13 ottobre\nSapori d’autunno\nBrentonico\n----\nvenerdì 18 ottobre\nDegusta l’autunno\nLavis\nsabato 19 ottobre\nCaneve en festa\nCembra Lisignago\nsabato 19 e domenica 20 ottobre\nFesta del marrone\nBrentonico\nsabato 19 ottobre\nTörggelen sulla Valsugana 47\nRoncegno Terme\nsabato 19 e domenica 20 ottobre\nSardagna in castagna\nTrento\ndomenica 20 ottobre\nUn \"Serso\" di vino\nPergine Valsugana\n-----\nvenerdì 25 ottobre\nPassioni d’autunno\nLavis\nda venerdì 25 a domenica 27 ottobre\nFesta della patata\nComano Terme\nsabato 26 ottobre\nAperitivo all’imbrunire con Peter Brunel\nRiva del Garda\nsabato 26 ottobre\nDal bosco a casa\nAltavalle\nsabato 26 e domenica 27 ottobre\nFesta della castagna\nRoncegno Terme\ndomenica 27 ottobre\nVini, castagne e Malegria\nGiovo\nPer info:\nStrada del Vino e dei Sapori del Trentino\ntel. 0461-921863 - info@stradavinotrentino.com\nDiVin Ottobre fa parte del calendario di manifestazioni enologiche denominato #trentinowinefest, organizzate con il supporto di Trentino Marketing ed è realizzato in collaborazione con La Trentina, BIM Adige, Comunità di Valle Alta Valsugana, Comunità di Valle Piana Rotaliana, Comunità di Valle Vallagarina, Comunità della Valle di Cembra."
  },
  {
   "name": "Halloween Trash Party",
   "date": "31/10/2019",
   "location": "Località\nArco",
   "sub_title": "Halloween Trash Party",
   "minidesc": "Festa in maschera con musica e dj-set",
   "dates": "Periodo\n31/10/2019",
   "category": "Tipologia\nFeste e Sagre",
   "fulldesc": "Halloween Trash Party\nFesta in maschera con musica e dj-set\nPeriodo\n31/10/2019\nLocalità\nArco\nTipologia\nFeste e Sagre\n? Halloween Trash Party ?\nLa festa della zucca è alle porte e non potevamo non festeggiare con una serata all'insegna del buon travestimento e della musica leggiadra, nostalgica e terrificante....\n? 5 h non-stop dance music 21:00 alle 02:00\nFree Entry\n? PROMOS ?\n? 21:00 - 22:30 = happy prize (birra media o spriz: 3 euro)\n? Good Mask = 1 free drink\n? Mask Contest (50 euro free drink prize)\n? DJS ? Smarmellata crew presenta:\n? DANIEL BOVA / ITM (Intelligence Trash Music)\n? PENNI MARCHET (EDM, Nostalgic, Italo)\n? DON REMO (Funk, Afrobeat, Nigga Dancefloor)\n? RULES ?\n? Dark and scary masks\n? Free Animals\n? Respect the park, the place and urself\n? No Glass, cans or whatever\n? No screams outside\n? No Nazi (except for Nazi-Zombie)"
  },
  {
   "name": "Shopping aspettando Halloween",
   "date": "26/10/2019 - 31/10/2019",
   "location": "Località\nRovereto",
   "sub_title": "Shopping aspettando Halloween",
   "minidesc": "Eventi da brivido nel centro storico della città",
   "dates": "Periodo\n26/10/2019 - 31/10/2019",
   "category": "Tipologia\nIntrattenimento della Località",
   "fulldesc": "Shopping aspettando Halloween\nEventi da brivido nel centro storico della città\nPeriodo\n26/10/2019 - 31/10/2019\nLocalità\nRovereto\nTipologia\nIntrattenimento della Località\nRovereto si prepara ad un’invasione di zucche, dolcetti, scherzetti, spaventose mascherine e spettacolari esibizioni circensi che stupiranno sia adulti che bambini!\nLa 16° edizione dell’evento è dedicata al mondo circense ed è un invito a vivere il centro storico di Rovereto sabato 26 e giovedì 31 ottobre, la notte di Halloween! Vetrine dei negozi allestite con zucche e fantasmi, spettacoli di danza itineranti e di tessuti aerei, laboratori di intaglio delle zucche, un'appassionante caccia al tesoro, un percorso di minimoto, una spaventosa casetta horror, truccabimbi, bolle di sapone, gonfiabili, trenino della paura e bancarelle con squisiti dolciumi e caldarroste sono solo alcune delle sorprese che ti aspettano! Un evento organizzato dall’Unione Commercio e Turismo e dal Consorzio Rovereto IN Centro in collaborazione con il Comune di Rovereto e l’Azienda per il Turismo Rovereto e Vallagarina. Principali attività Sabato 26 ottobre\ndalle 10.00 in Largo Foibe Gonfiabili per tutti i bambini\ndalle 10.00 alle 12.00 e dalle 14.30 alle 17.30 in Via Roma “Laboratorio di intaglio della zucca“\ndalle 14.30 alle 18.30 in Via Roma truccabimbi “Truccamimè“\ndalle 14.30 alle 18.30 nel Cortile Urbano di Via Roma la “Casetta degli orrori“\ndalle 14.30 alle 18.30 “Circuito di mini moto” con il Motoclub Pippo Zanini\ndalle 15.00 alle 18.00 in Piazza Malfatti “I misteriosi giochi di una volta“\nalle 15.30 “Caccia al tesoro” che porterà bambini e genitori nei vari negozi aderenti dove dovranno trovare la soluzione a diversi indovinelli e ricevere piccoli omaggi a sorpresa. I bambini verranno accompagnati in piccoli gruppi da operatori qualificati.\ndalle 15.30 Spettacolo itinerante nelle vie del centro a cura del Circo Dylan\nGiovedì 31 ottobre\ndalle 16.00 “Atmosfera magica con le lanterne” i negozi del centro si illumineranno con la luce di tante piccole lanterne\ndalle 16.30 “Dolcetto o scherzetto?” i negozi del centro aspetteranno i bambini travestiti da streghe e maghetti per distribuire loro tante dolci leccornie\ndalle 21.00 “Halloween Party” nei locali della città con speciali drink ed esibizioni musicali itineranti."
  },
  {
   "name": "Cinema ad Arco",
   "date": "05/10/2019 - 31/10/2019",
   "location": "Località\nArco",
   "sub_title": "Cinema ad Arco",
   "minidesc": "I migliori film della stagione cinematografica",
   "dates": "Periodo\n05/10/2019 - 31/10/2019",
   "category": "Tipologia\nCinema",
   "fulldesc": "Cinema ad Arco\nI migliori film della stagione cinematografica\nPeriodo\n05/10/2019 - 31/10/2019\nLocalità\nArco\nTipologia\nCinema\nVAI AL PROGRAMMA"
  },
  {
   "name": "Trekking sul Monte Colodri e sul Monte Colt",
   "date": "13/06/2019 - 31/10/2019",
   "location": "Località\nArco",
   "sub_title": "Trekking sul Monte Colodri e sul Monte Colt",
   "minidesc": "Passo dopo passo: ecco Arco dall’alto!",
   "dates": "Periodo\n13/06/2019 - 31/10/2019",
   "category": "Tipologia\nVisite Guidate",
   "fulldesc": "Trekking sul Monte Colodri e sul Monte Colt\nPasso dopo passo: ecco Arco dall’alto!\nPeriodo\n13/06/2019 - 31/10/2019\nLocalità\nArco\nTipologia\nVisite Guidate\nVolete mettervi alla prova e scoprire le vostre abilità per seguirci nei nostri trekking lunghi?\nIn questo trekking sarete guidati su un sentiero piacevole e mai banale, con piccoli e divertenti tratti rocciosi dove potrete migliorare la vostra tecnica di camminata.\nIl Monte Colodri si trova esattamente sopra Arco, a soli 340 metri di quota. Non saliamo dalla classica via ferrata, ma proponiamo un’alternativa piacevole e altrettanto spettacolare. Dall’alto, percorrendo il filo di cresta verso il Monte Colt, potremo inoltre comprendere l’origine delle pareti verticali della Valle del Sarca.\nPercorso\nKm 5.5 – h 3 – dislivello ↑450 m ↓450 m\nAttraversato il centro storico di Arco, dalla Chiesa della Collegiata percorriamo la caratteristica scalinata che conduce al Castello. L’Olivaia di Arco, posta sulle pendici della rupe del Castello, ci accompagna con la sua storia secolare. Scorgiamo le torri del Castello di Arco e alcuni tratti dell’antico muro di cinta della città, poi deviamo verso la Chiesa di S. Maria di Laghel. Da qui, il sentiero (SAT 431) entra in un bosco di lecci e ci conduce con scalini rocciosi al Monte Colodri (340 m). Una volta raggiunta la cima, ci troviamo esattamente al di sopra delle storiche vie di arrampicata di Arco, dove tutto iniziò negli strepitosi anni ’80. Insieme conosceremo alcuni dei più importanti arrampicatori del panorama internazionale attraverso le loro vie, a cui sarà per sempre legato il loro nome. La vista a 360 gradi spazia dal Lago di Garda, alla catena del Monte Baldo, alle Marocche di Dro.\nDopo una piccola pausa, proseguiamo verso nord, lungo la cresta che conduce al Monte Colt (415 m). Placche appoggiate, rocce carsiche, tratti erbosi, scalini naturali, ghiaioni e brevi tratti esposti. Un mix di terreni perfetto per imparare a sentirci a nostro agio in ogni situazione! Numerose e piacevoli vie di rientro ci riconducono al centro di Arco e al nostro punto di partenza.\nPrenotazione\nPresso gli Uffici informazione Garda Trentino di Riva del Garda, Arco e Torbole sul Garda\noppure\nPrenota qui"
  },
  {
   "name": "Il Sacro e il Quotidiano. Il villaggio tardoantico a San Martino ai...",
   "date": "04/10/2019 - 01/11/2019",
   "location": "Località\nRiva del Garda",
   "sub_title": "Il Sacro e il Quotidiano. Il villaggio tardoantico a San Martino ai Campi",
   "minidesc": "Una nuova mostra al MAG a 50 anni dalla scoperta del sito archeologico",
   "dates": "Periodo\n04/10/2019 - 01/11/2019",
   "category": "Tipologia\nMostre",
   "fulldesc": "Il Sacro e il Quotidiano. Il villaggio tardoantico a San Martino ai Campi\nUna nuova mostra al MAG a 50 anni dalla scoperta del sito archeologico\nPeriodo\n04/10/2019 - 01/11/2019\nLocalità\nRiva del Garda\nTipologia\nMostre\nA 50 anni dalla scoperta dell'area archeologica di San Martino ai Campi, sarà inaugurata venerdì 4 ottobre 2019 alle 18.30 al MAG la mostra Il Sacro e il Quotidiano. Il villaggio tardoantico a San Martino ai Campi, curata dalla Soprintendenza per i beni culturali – Ufficio beni archeologici de lla Provincia autonoma di Trento. Ingresso libero.\nIn posizione strategica lungo quelle che in antichità erano importanti vie di comunicazione, frequentato fin dalla protostoria, il sito di San Martino ai Campi è caratterizzato da significative strutture di età romana e medievale. Nel periodo di passaggio fra queste due epoche, nel IV secolo d.C., sul versante meridionale del Monte viene costruito un villaggio, probabilmente con finalità militari. Circa duecento anni dopo un incendio distrugge la gran parte dell’abitato, che però continua a vivere, anche attraverso la devozione cristiana.\nPer celebrare i 50 anni dalla scoperta del sito avvenuta nel 1969, reperti e strutture di questo villaggio sono stati ricomposti in una narrazione del quotidiano che si scoprirà in frequente dialogo con il sacro.\nIl Sacro e il Quotidiano | Il villaggio tardoantico a San Martino ai Campi\nMonte San Martino, importante area archeologica nota come luogo sacro per i Reti e i Romani, mostra anche i resti di un villaggio del IV secolo d.C., distrutto in parte da un incendio due secoli dopo. Il villaggio di Monte San Martino era costituito da edifici ben distribuiti, con strade che li collegavano e un grande fabbricato che dominava la valle.\nLa mostra, curata da Achillina Granata di Archeogeo e Cristina Dal Rì e Nicoletta Pisu della Soprintendenza per i beni culturali – Ufficio beni archeologici della PAT, si snoda come un primo racconto di questa fase della storia del Monte ancora in larga parte sconosciuta.\nVisite guidate alla mostra\nNelle giornate di domenica 13 e domenica 27 ottobre 2019 sarà possibile partecipare a una visita guidata gratuita alla mostra alle ore 11.00, condotta da Matteo Rapanà (direzione MAG Museo Alto Garda)."
  },
  {
   "name": "Forte Pozzacchio: eventi e aperture",
   "date": "01/06/2019 - 03/11/2019",
   "location": "Località\nTrambileno",
   "sub_title": "Forte Pozzacchio: eventi e aperture",
   "minidesc": "Spettacoli, incontri, ricordi nell'ultima fortezza dell'Impero austro-ungarico",
   "dates": "Periodo\n01/06/2019 - 03/11/2019",
   "category": "Tipologia\nSpettacoli, Visite Guidate",
   "fulldesc": "Forte Pozzacchio: eventi e aperture\nSpettacoli, incontri, ricordi nell'ultima fortezza dell'Impero austro-ungarico\n1 altre immagini\nPeriodo\n01/06/2019 - 03/11/2019\nLocalità\nTrambileno\nTipologia\nSpettacoli, Visite Guidate\nForte Pozzacchio propone eventi di grande spessore, che si affiancano al calendario delle visite guidate nel weekend.\nVisite guidate al forte\n7 e 28 luglio ore 14\n11, 15 e 25 agosto ore 14\n8 e 22 settembre ore 14\n6 e 20 ottobre ore 14\n3 novembre ore 14\nSu prenotazione, al costo di € 5 Appuntamenti speciali al Forte\n20 luglio: Letti di Luna (scarica la locandina in pdf)\n21 luglio: Festa di Commemorazione dei Caduti organizzata dall'Associazione ACR Il Forte (scarica la locandina in pdf)\n4 e 25 agosto: Sentinelle di pietra. Il 4 agosto \"Frequenze forti\" e il 25 agosto \"Sentieri silenziosi\"(scarica il programma in pdf)\nAperture 2019\nGiugno, luglio, agosto e settembre: dal giovedì alla domenica dalle 10.00 alle 18.00 (ultimo ingresso alle 16.30).\nOttobre e novembre: il sabato e la domenica dalle 10.00 alle 17.00 (ultimo ingresso alle 15.30)."
  },
  {
   "name": "ANTICHI SAPORI DELLA VAL DI NON",
   "date": "18/10/2019 - 03/11/2019",
   "location": "Località\nCles",
   "sub_title": "ANTICHI SAPORI DELLA VAL DI NON",
   "minidesc": "Riscopri le antiche ricette della tradizione nonesa, menù speciali dal 18 ottobre al 3 novembre 2019",
   "dates": "Periodo\n18/10/2019 - 03/11/2019",
   "category": "Tipologia\nEnogastronomia"
  },
  {
   "name": "Fratello Lupo",
   "date": "30/03/2019 - 03/11/2019",
   "location": "Località\nLuserna",
   "sub_title": "Fratello Lupo",
   "minidesc": "L'alleanza uomo/cane per la vita",
   "dates": "Periodo\n30/03/2019 - 03/11/2019",
   "category": "Tipologia\nMostre",
   "fulldesc": "Fratello Lupo\nL'alleanza uomo/cane per la vita\nPeriodo\n30/03/2019 - 03/11/2019\nLocalità\nLuserna\nTipologia\nMostre\nIl cane è uno degli animali da compagnia più diffusi. Si tratta di esseri viventi che fin dall’antichità sono stati addomesticati dall’uomo per utilizzarli nelle più svariate attività (si pensi ad esempio alla caccia o alla difesa del gregge).\nQuesto rapporto ha subito un’evoluzione nel corso dei secoli: oggi sentiamo parlare di come la scienza scopra nei cani doti speciali e straordinarie, in grado, ad esempio, di individuare preventivamente l’insorgere di determinate patologie nell’essere umano.\nAttraverso questa mostra, che integra la mostra sul “Ritorno del lupo” – prendendo spunto dal noto episodio che vide San Francesco ammansire un lupo, divenuto poi “amico” della locale comunità di Gubbio – si approfondisce un tema molto importante e attuale: l’alleanza tra uomo e cane, ovvero il modo nel quale oggi l’attività cinofila supporta l’intervento dell’uomo in diverse situazioni di bisogno (ad esempio nella ricerca di persone disperse, nel salvataggio sotto le valanghe, nel sostegno alle persone non vedenti), ma anche per creare sollievo in particolari situazioni sociali e sanitarie (pensiamo alla pet therapy). Con questa mostra si vuole sensibilizzare ulteriormente circa l’importanza degli animali dentro la nostra società e evidenziare il loro contributo al progresso della nostra civiltà.\nLa mostra è stata pensata con una particolare attenzione ai bambini e ai ragazzi, per sensibilizzarli su questa tematica e orientarli a un corretto e rispettoso rapporto con il mondo animale.\nAPERTO TUTTI I GIORNI CON ORARIO 10.00 - 12.30 e 14.00 - 18.00\nIn agosto: 09.30 - 12.30 e 14.00 - 18.30\nNei mesi di luglio e agosto saranno aperte anche la Casa museo \"Haus von Prükk\" e la Pinacoteca \"R.M. Pedrazza\",\nIn qualsiasi periodo visite guidate su prenotazione in italiano, cimbro e tedesco per gruppi.\nINFO\nMuseo Centro Documentazione Luserna\nvia Trento, 6 38040 Luserna (TN)\n0464 789638\ninfo@lusern.it\nwww.lusern.it"
  },
  {
   "name": "La forma dello Sport",
   "date": "14/04/2019 - 03/11/2019",
   "location": "Località\nRiva del Garda",
   "sub_title": "La forma dello Sport",
   "minidesc": "Una nuova mostra dedicata alle architetture e attività sportive che hanno caratterizzato l'identità della città di Riva",
   "dates": "Periodo\n14/04/2019 - 03/11/2019",
   "category": "Tipologia\nMostre",
   "fulldesc": "La forma dello Sport\nUna nuova mostra dedicata alle architetture e attività sportive che hanno caratterizzato l'identità della città di Riva\n2 altre immagini\nPeriodo\n14/04/2019 - 03/11/2019\nLocalità\nRiva del Garda\nTipologia\nMostre\nUna nuova mostra dedicata alle architetture e attività sportive che hanno caratterizzato la costruzione dell’identità della città di Riva del Garda fin dall’inizio del secolo scorso accoglierà i visitatori del MAG durante la stagione 2019 del Museo Alto Garda.\nSe negli anni più recenti il piano terra della Rocca di Riva in cui ha sede il Museo ha dato vita a esposizioni che attraverso la fotografia hanno raccontato di paesaggi storici e visioni contemporanee, quest’anno si è voluto rendere fruibili al pubblico i beni conservati nelle collezioni del MAG, combinando i materiali dell’archivio fotografico con quelli custoditi nei depositi.\nFilo conduttore di questa narrazione, che alterna materiale documentale, video, fotografia, disegno e scultura, è lo sport, con l’intento di rendere un piccolo omaggio alle origini di quel mondo dell’outdoor che nel corso del tempo è diventato uno degli assi portanti dell’economia e dell’identità di Riva del Garda e che da sempre è un punto di riferimento per molte realtà associative cittadine.\nIl progetto espositivo incrocia trasversalmente due dei principali fondi delle collezioni del MAG: quello dedicato all’architetto Giancarlo Maroni e quello dello scultore rivano Silvio Zaniboni, entrambi molto attivi tra gli anni Venti e Trenta del Novecento.\nIl percorso espositivo si apre con due progetti di architetture che Giancarlo Maroni firma tra gli anni Venti e Trenta e che diventano il teatro di importanti momenti di vita sportiva: il Campo Littorio Benacense e la Spiaggia degli Olivi. Fotografie, schizzi, pubblicazioni, progetti, trofei e video raccontano la storia di questi due luoghi. I materiali del MAG sono arricchiti da alcuni preziosi prestiti da parte della Fraglia Vela e della S.S. Benacense di Riva del Garda.\nIl Campo Littorio Benacense nasce per soddisfare la richiesta di uno spazio dedicato allo sport che la comunità manifesta fin dai primi anni del Novecento. Sono diversi gli spazi che fanno da teatro alle competizioni e alle manifestazioni atletiche prima che la città di Riva nel 1931 porti a compimento il progetto dello stadio. La genesi di questa architettura si intreccia con il grande progetto di propaganda sportiva messo in atto in quegli anni dal regime, che vede realizzare in tutta Italia luoghi destinati a diventare il teatro di spettacolari coreografie che incanalano il lavoro che il Fascismo compie nel tentativo di plasmare una nuova generazione di italiani attraverso la capillare organizzazione di associazioni che curano la preparazione fisica di bambini e bambine: i soldati e le madri del futuro.\nIl 1934 è l’anno dell’inaugurazione della Spiaggia degli Olivi, una moderna struttura balneare destinata a ospitare i momenti di svago di un’elegante borghesia in cerca di piacevoli momenti all’aria aperta, ma anche sede della prestigiosa Fraglia della Vela, che proprio nel Ventennio vede consolidarsi la sua autonomia intrecciando la propria vicenda con le visionarie idee di Gabriele D'Annunzio, che da grande estimatore di Maroni e amante del Garda omaggia in diverse occasioni il club velico di Riva.\nLa Spiaggia degli Olivi e la sua duplice natura divisa tra svago e agonismo sono raccontate da una selezione di materiali che tracciano una storia che comincia in quello spazio in riva al lago, attiguo al parco della Rocca dove all’inizio del Novecento aveva sede il gruppo Canottieri di Riva. Negli anni Trenta la metamorfosi: da un luogo a totale vocazione sportiva si passa a un moderno stabilimento balneare, che si inserisce nel nuovo volto di una città che nel dopoguerra ripensa i propri spazi provando a proporsi sempre più come una prestigiosa località turistica.\nUna selezione di filmati storici degli anni Trenta, provenienti dagli archivi dell’Istituto Luce, documenta alcuni avvenimenti sportivi che si sono svolti proprio alla Spiaggia degli Olivi e nel Campo Benacense: dalla storica regata dei Bragozzi tenutasi in occasione dell’inaugurazione di uno dei due tratti della Strada Gardesana alle immagini del ritiro della Nazionale di Pallacanestro in vista delle Olimpiadi del 1936.\nFotografie storiche di ampie dimensioni e retroilluminate mostrano poi alcune immagini che testimoniano il lungo sodalizio che lega la città di Riva con lo sport e la vita all’aria aperta: le coreografiche performance che aprono le prime stagioni sportive dello stadio Benacense, le vele che riempiono l’orizzonte oltre la Spiaggia degli Olivi con i loro profili slanciati, le competizioni ufficiali, la mondanità della spiaggia e il divertimento del nuoto e dei tuffi.\nLa mostra si conclude incontrando l’opera di Silvio Zaniboni, scultore di Riva che tra gli anni Venti e Trenta lavora alla decorazione di prestigiosi edifici quali la Borsa e il Palazzo dell’Arengario di Milano, progetta il complesso dell’Acropoli Alpina sul Doss Trento e a Riva collabora strettamente con Giancarlo Maroni realizzando le decorazioni per le sue architetture: è di Zaniboni il disegno della scultura Il Genio delle Acque che decora la facciata della Centrale del Ponale. Nella sua produzione si identifica un filone di opere decorative legate a edifici sportivi. Negli anni Trenta partecipa alla realizzazione dell’apparato decorativo dello Stadio dei Marmi di Roma firmando due delle sessanta statue monumentali che rappresentano le diverse discipline sportive. Sempre nello stesso periodo realizza il fregio che orna la facciata della Piscina Cozzi di Milano. Nella mostra è esposto proprio il modello in gesso di questa decorazione, che dialoga con le fotografie che Gabriele Basilico scattò in occasione della mostra e del catalogo Silvio Zaniboni. La scultura decorativa e la città, realizzati dal Museo nel 1996. La sala dedicata a Silvio Zaniboni ospita anche i disegni preparatori per la decorazione di una fontana che si trovava nel giardino della scuola Mameli a Milano. Il fregio, opera tarda dell’artista, che raffigura degli adolescenti impegnati nella pratica di diversi sport, è accostato a un album fotografico che documenta passo passo l’attività del gruppo Marinaretti di Riva."
  },
  {
   "name": "La ferita della bellezza. Alberto Burri e il Grande Cretto di...",
   "date": "22/06/2019 - 03/11/2019",
   "location": "Località\nRiva del Garda",
   "sub_title": "La ferita della bellezza. Alberto Burri e il Grande Cretto di Gibellina",
   "minidesc": "Una rilettura del percorso dell'artista a partire dall'opera di Land Art più grande al mondo",
   "dates": "Periodo\n22/06/2019 - 03/11/2019",
   "category": "Tipologia\nMostre",
   "fulldesc": "La ferita della bellezza. Alberto Burri e il Grande Cretto di Gibellina\nUna rilettura del percorso dell'artista a partire dall'opera di Land Art più grande al mondo\nPeriodo\n22/06/2019 - 03/11/2019\nLocalità\nRiva del Garda\nTipologia\nMostre\nVerrà inaugurata venerdì 21 giugno 2019 alle ore 18.30 al MAG di Riva del Garda la mostra curata da Massimo Recalcati La ferita della bellezza. Alberto Burri e il Grande Cretto di Gibellina.\nAlberto Burri, chiamato a realizzare un intervento per la ricostruzione del paese distrutto dal terremoto nella Valle del Belice del 1968, decide di intervenire sulle macerie della città di Gibellina, creando l’opera di Land Art più grande al mondo. Le ricopre di un sudario bianco, di un’enorme gettata di cemento che ingloba i resti e riveste, in parte ricalcandola, la planimetria della vecchia Gibellina.\nLa mostra La ferita della bellezza. Alberto Burri e il Grande Cretto di Gibellina è un progetto itinerante curato da Massimo Recalcati con il coordinamento scientifico di Alessandro Sarteanesi, prodotta e realizzata da Magonza editore. Dopo essere stata allestita nelle sale del Museo Carlo Bilotti – Aranciera di Villa Borghese di Roma, giunge al MAG di Riva del Garda, in collaborazione con il Mart Museo di arte moderna e contemporanea di Trento e Rovereto, dal 22 giugno al 3 novembre 2019.\nPartendo dal grande intervento del Grande Cretto di Gibellina, l'esposizione risale il percorso dell'artista con una selezione di lavori esemplari, letti in relazione alla poetica della ferita, tema che nell’interpretazione di Massimo Recalcati attraversa la sua intera opera, incidendo la materia, disegnando strappi, lacerazioni, crettature, bruciature, giungendo sino a declinazioni inedite che pensano ad una genesi e a un processo di carattere spirituale.\nCulmine del percorso interpretativo sono le fotografie in bianco e nero di Aurelio Amendola sul Grande Cretto. Fotografo che per eccellenza ha raccolto le immagini di Burri, dei suoi lavori e dei processi creativi, Amendola ha realizzato gli scatti in due riprese, nel 2011 e nel 2018, a completamento avvenuto dell’opera (2015).\nNel percorso inoltre, il video Il Grande Cretto di Gibellina di Petra Noordkamp – prodotto e presentato nel 2015 dal Guggenheim Museum di New York, in occasione della grande retrospettiva The Trauma of Painting – filma in un racconto poetico e di grande sapienza tecnica l’opera di Burri e il paesaggio circostante.\nAlcune opere uniche dell’artista, veri e propri capolavori, inoltre, estendono non solo ai Cretti ma anche ai Sacchi, ai Catrami, alle Plastiche e a una selezione di opere grafiche la lettura proposta dal celebre psicanalista.\n«È una ferita che è dappertutto, che trema ovunque. Una scossa, un tormento, un precipitare di fessurazioni infinite ed ingovernabili». Come scrive Recalcati in Alberto Burri e il Grande Cretto di Gibellina, «nei Legni la ferita è generata dal fuoco e dalla carbonizzazione del materiale ma, soprattutto, dal resto che sopravvive alla bruciatura. Nelle Combustioni, lo sgretolamento della materia, la manifestazione della sua umanissima friabilità, della sua più radicale vulnerabilità, viene restituita con grande equilibrio poetico e formale. È ciò che avviene anche con le Plastiche dove, ancora una volta, è sempre l’uso del fuoco a infliggere su di una materia debole ed inconsistente come la plastica, l’ustione della vita e della morte».\nLa mostra è patrocinata dalla Fondazione Palazzo Albizzini Collezione Burri, dalla Regione Sicilia, dal Comune di Gibellina e dalla Fondazione Orestiadi.\nIn occasione della mostra è realizzato dalla casa editrice Magonza un importante volume stampato su carta di pregio e di grande formato con testimonianze e ricerche inedite su Alberto Burri, la sua opera e Il Grande Cretto di Gibellina. Un nuovo testo di Massimo Recalcati raccoglierà gli sviluppi ulteriori della sua ricerca, insieme a interventi di storici dell'arte quali Gianfranco Maraniello e Aldo Iori."
  },
  {
   "name": "URSUS - STORIE DI UOMINI E DI ORSI",
   "date": "06/07/2019 - 03/11/2019",
   "location": "Località\nCles",
   "sub_title": "URSUS - STORIE DI UOMINI E DI ORSI",
   "minidesc": "Nella splendida cornice di Palazzo Assessorile, una mostra alla scoperta del rapporto speciale che intercorre fra uomini e orsi dalla Preistoria ai giorni nostri.",
   "dates": "Periodo\n06/07/2019 - 03/11/2019",
   "category": "Tipologia\nMostre",
   "fulldesc": "URSUS - STORIE DI UOMINI E DI ORSI\nNella splendida cornice di Palazzo Assessorile, una mostra alla scoperta del rapporto speciale che intercorre fra uomini e orsi dalla Preistoria ai giorni nostri.\nPeriodo\n06/07/2019 - 03/11/2019\nLocalità\nCles\nTipologia\nMostre\nIl rapporto tra uomini e orsi nell’emisfero settentrionale è antico di migliaia di anni: la nostra e la loro storia si intrecciano fortemente, modificandosi nel corso dei secoli e assumendo importanti connotazioni simboliche. La mostra “Ursus. Storie di uomini e orsi” si propone di illustrare, in modo emblematico e non sistematico e con una precisa valenza divulgativa e didattica, questo lungo percorso, focalizzando l’attenzione, per quanto possibile, sulla realtà locale.\nUn capitolo importante è dedicato a san Romedio che doma e sottomette l’orso. La presenza del santuario in val di Non e la forte devozione ad esso collegata ha fatto sì che venissero prodotti, nel corso dei secoli, molti dipinti ed ex-voto e che la rappresentazione del miracolo del Santo duri, rinnovata, per tutto il Novecento fino ai giorni nostri.\nPer il Trentino il progetto Life Ursus ha proposto un rinnovato rapporto tra uomini e orsi, spesso anche conflittuale e problematico, ma in continuità con una storia millenaria che la mostra si propone di raccontare per favorirne la conoscenza e stimolare la riflessione."
  },
  {
   "name": "La Grande mostra fotografica del popolo",
   "date": "28/09/2019 - 07/11/2019",
   "location": "Località\nArco",
   "sub_title": "La Grande mostra fotografica del popolo",
   "minidesc": "Foto e cartoline dal 1887 al 1977 e riviste, fumetti e dischi anni '20, '30, '40, '50 e '60",
   "dates": "Periodo\n28/09/2019 - 07/11/2019",
   "category": "Tipologia\nMostre",
   "fulldesc": "La Grande mostra fotografica del popolo\nFoto e cartoline dal 1887 al 1977 e riviste, fumetti e dischi anni '20, '30, '40, '50 e '60\n2 altre immagini\nPeriodo\n28/09/2019 - 07/11/2019\nLocalità\nArco\nTipologia\nMostre\nTorna al Casinò di Arco l'appuntamento con la Grande mostra fotografica del popolo organizzata da Sergio Matteotti.\nSaranno esposte:\n2250 foto della seconda guerra mondiale,\n9900 foto della vita sociale dell'Alto Garda\n11mila cartoline dell'Alto Garda e valli del Trentino Alto Adige\n1900 foto di varie città olandesi\n290 foto di Limone e Tremosine\n585 foto di Rovereto, Ala, Avio, Mori\n600 foto di Trento sobborghi e frazioni\nInoltre verranno esposte riviste storiche dagli anni Venti agli anni Settanta\ne inoltre fumetti e riviste anni '20, '30, '40, '50, '60 e dischi del 1930.\nPer informazioni 377 4958911\nEntrata dagli Uffici Amsa del Casinò"
  },
  {
   "name": "Incontri di Analisi e Composizione",
   "date": "26/04/2019 - 08/11/2019",
   "location": "Località\nRiva del Garda",
   "sub_title": "Incontri di Analisi e Composizione",
   "minidesc": "Tavola rotonda con musicologi e concerto",
   "dates": "Periodo\n26/04/2019 - 08/11/2019",
   "category": "Tipologia\nAltro",
   "fulldesc": "Incontri di Analisi e Composizione\nTavola rotonda con musicologi e concerto\nPeriodo\n26/04/2019 - 08/11/2019\nLocalità\nRiva del Garda\nTipologia\nAltro\nProgramma 2019\nRiva del Garda\nAula 14, conservatorio\nh. 16.00\n8 marzo - Le analisi: Le voci bianche nell'opera\n28 marzo - Alfonso Alberti - Le analisi: I Quadri di un'esposizione: testo e interpretazione, Introduzione di Francesca Aste\n26 aprile - Giorgio Benati - Le analisi: Aspetti numerologici nelle composizioni organistiche di J.S. Bach\n27 maggio - Tarcisio Battisti, Paolo de Zen - Le analisi: Buxtheude, alle origini del pensiero banchiano\n7 giugno - Tavola rotonda: Sinestesia, la musica e i cinque sensi\n3 settembre - Angela Carone - Le analisi: Renato de Grandis. Un compositore veneziano a Darmstadt\n11 ottobre - Trio's Kras - Heures seculaires et instantanées: lezione concerto a cura del Trio's Kras\n8 novembre - Musica e Architettura: Tavola rotonda: studi e prospettive"
  },
  {
   "name": "Parigi. Artisti trentini 1900-1989",
   "date": "21/09/2019 - 10/11/2019",
   "location": "Località\nTenno",
   "sub_title": "Parigi. Artisti trentini 1900-1989",
   "minidesc": "Mostra di pittura e scultura",
   "dates": "Periodo\n21/09/2019 - 10/11/2019",
   "category": "Tipologia\nMostre",
   "fulldesc": "Parigi. Artisti trentini 1900-1989\nMostra di pittura e scultura\nPeriodo\n21/09/2019 - 10/11/2019\nLocalità\nTenno\nTipologia\nMostre\nInaugurazione 21 settembre ore 17.00\nSalone e avvolti: «Parigi e gli artisti trentini. 1900-1989», mostra di pittura e scultura\nIn coincidenza della Giornata europea del patrimonio artistico\nUn omaggio alla dimensione senza confini dell'arte\nUn percorso a ritroso nella città che ha fatto la storia dell'arte nel mondo, luogo di formazione e fascinazione per molti artisti del Novecento. Parigi è più vicina di quanto sembri al nostro territorio. Renato Ischia, scultore, sceglie la città francese per formarsi e per nutrire il seme dell'arte, che prima Fra Silvio Bottes, poi Giuseppe Sorraperra, poi l'Accademia di Firenze aveva coltivato. Lo scultore Fernando Ciancianarini detto Cian che visse per molti anni a Torbole, il pittore Silvio Clerico che parte da Arco si sposa a Parigi e Paolo Vallorz che da Caldes parte giovanissimo per Parigi dove consacrerà la sua arte pittorica. Questi solo alcuni dei nomi che saranno protagonisti della ricerca inedita."
  },
  {
   "name": "Festival Giallo Garda",
   "date": "19/10/2019 - 15/11/2019",
   "location": "Località\nRiva del Garda",
   "sub_title": "Festival Giallo Garda",
   "minidesc": "Tornano a Riva del Garda gli incontri con gli scrittori per accendere sul lago la “passione gialla”",
   "dates": "Periodo\n19/10/2019 - 15/11/2019",
   "category": "Tipologia\nAltro",
   "fulldesc": "Festival Giallo Garda\nTornano a Riva del Garda gli incontri con gli scrittori per accendere sul lago la “passione gialla”\nPeriodo\n19/10/2019 - 15/11/2019\nLocalità\nRiva del Garda\nTipologia\nAltro\nPROGRAMMA:\nSabato 19 ottobre ore 10.30\n\"Badù e il nemico del sole\" , con Francesca Ceci\nGraphic novel per ragazzi\nSabato 26 ottobre ore 10.30\n\"La gemma del Cardinale de' Medici\", con Patrizia Debicke Van Der Noot\nModera Gabriele Marazzina\nCon proiezione e spiegazione delle più rappresentative figure dei Medici...\nSabato 9 novembre ore 10.30\n\"Asia. Ombre e intrighi nella Brescia che conta\" di Roberto Van Heugten\nModera Lorenzo Bernasconi\nLetture a cura di Paola Raggi\nVenerdì 15 novembre ore 17.30\n\"Il codice Debussy\" di Lorenzo Della Fonte\nAccompagnamento al pianoforte del Maestro Alessandro Trebeschi\nModera Laura Marsadri"
  },
  {
   "name": "Artisti per Arrigo",
   "date": "28/09/2019 - 20/11/2019",
   "location": "Località\nRiva del Garda",
   "sub_title": "Artisti per Arrigo",
   "minidesc": "Mostra collettiva in omaggio ad Arrigo Colorio",
   "dates": "Periodo\n28/09/2019 - 20/11/2019",
   "category": "Tipologia\nMostre",
   "fulldesc": "Artisti per Arrigo\nMostra collettiva in omaggio ad Arrigo Colorio\nPeriodo\n28/09/2019 - 20/11/2019\nLocalità\nRiva del Garda\nTipologia\nMostre\nIl Centro Culturale La Firma dedica il 2019 al suo fondatore, il gallerista Arrigo Colorio.\nAccanto alla mostra di Pietro Ghizzardi, allestita durante l’estate, si è pensato di ricordare Arrigo Colorio attraverso un’esposizione che vede protagonisti i tanti\namici che hanno frequentato la Galleria che un tempo si trovava in via Maffei, nel cuore del centro storico.\nInaugurazione 28.09, ore 18.00"
  },
  {
   "name": "Castello di Avio per famiglie",
   "date": "22/04/2019 - 24/11/2019",
   "location": "Località\nAvio",
   "sub_title": "Castello di Avio per famiglie",
   "minidesc": "Attività e visite guidate per grandi e piccini",
   "dates": "Periodo\n22/04/2019 - 24/11/2019",
   "category": "Tipologia\nIntrattenimento della Località, Visite Guidate",
   "fulldesc": "Castello di Avio per famiglie\nAttività e visite guidate per grandi e piccini\n1 altre immagini\nPeriodo\n22/04/2019 - 24/11/2019\nLocalità\nAvio\nTipologia\nIntrattenimento della Località, Visite Guidate\nAnche quest’anno la primavera porterà al Castello di Avio un ricco programma dedicato ai più piccoli. Giochi, visite guidate, caccia al tesoro ti faranno scoprire gli angoli più nascosti di questo affascinante maniero.\nPasquetta al Castello Pic-nic tra le mura del Castello con avvincente caccia al tesoro per i più piccoli alla scoperta degli aspetti curiosi ed insoliti legati alla storia di questa imponente fortificazione. Nel pomeriggio intrattenimento musicale, colomba pasquale e thè caldo per tutti. Possibilità di prenotare un cestino pic-nic presso la “Locanda del Castello”. Quando: 22 aprile dalle 10 alle 18 Giorni di festa al Castello Visite guidate per tutti al termine delle quali si potrà tornare indietro nel tempo rivivendo tra storia e leggenda le vicende accadute tra le mura di questo affascinante maniero ai tempi del suo massimo splendore. Chi lo desidera potrà effettuare il pic-nic all’interno del Castello oppure prenotare un cestino pic-nic presso la “Locanda del Castello”. Quando: 25 aprile e 1 maggio dalle 10 alle 18 Percorso gioco per bambini Anche quest’anno viene proposto ai piccoli visitatori un avvincente percorso-gioco che saprà rendere divertente e coinvolgente la visita. I piccoli visitatori potranno conoscere in maniera divertente e coinvolgente numerosi aspetti legati alla vita nel medioevo, scoprendo insieme ai loro genitori aspetti storici e architettonici di questa affascinante fortificazione medievale. Quando: dal 26 maggio fino al 24 novembre (in orario di apertura castello) Inaugurazione del Percorso gioco per bambini In occasione dell’inaugurazione del nuovo percorso-gioco gli spazi del Castello si animeranno come per magia, coinvolgendo grandi e piccini con affascinanti racconti che li aiuteranno a scoprire la storia e le vicende legate a questo bellissimo maniero. In occasione della giornata si potranno degustare i prodotti enogastronomici del nostro territorio. Quando: 2 giugno dalle 10 alle 18 Ti racconto il Castello – Il medioevo Avvincente viaggio nel tempo con i personaggi maggiormente legati alla storia del Castello di Avio: saranno loro ad accompagnare i visitatori alla scoperta delle parti più incantevoli e segrete del maniero, seguendo per i più piccoli tracce ed indizi del percorso gioco. Sarà inoltre allestito un accampamento medioevale con la possibilità di conoscere usi, costumi, armi e tecniche di combattimento dell’epoca. Per tutte e tre le date sarà possibile effettuare il pic-nic all’interno del Castello. Possibilità di prenotare un cestino pic-nic presso la “Locanda del Castello”. Quando: 11, 15 e 25 agosto dalle 10 alle 18 Ti racconto il Castello – La vita dei contadini Anche per quest’anno il FAI propone a grandi e piccini una giornata dedicata alla scoperta di usi e costumi della vita contadina ai tempi del medioevo. Laboratori, didattica medioevale, giochi e sorprese si susseguiranno lungo il percorso di visita del Castello. Quando: 29 settembre dalle 10 alle 18 Una visita da brivido! Si ripete anche quest'anno quello che ormai è diventato un appuntamento fisso tra le mura del Castello di Avio. L'affascinante maniero che domina la Vallagarina si ammanterà di mistero per divertire e coinvolgere grandi e piccini con incontri da brivido, prove di coraggio e simpatiche animazioni lungo l’intero percorso di visita. Dolcetto e scherzetto per i più piccoli, thè caldo e Vin Brulè per tutti concluderanno questa divertentissima esperienza. Quando: 27 ottobre dalle 10 alle 17 Aspettando il Natale – La leggenda di Santa Klaus Il mito di Babbo Natale nasce dalla leggenda di San Nicola, Vescovo cristiano vissuto nel IV secolo. Nell'affascinante cornice di uno dei più bel castelli del Trentino la sua leggenda prenderà vita con suggestive narrazioni accompagnate da magici suoni legati alla tradizione natalizia. Durante la giornata verrà proposto a grandi e piccini particolari visite guidate che li sapranno immergere nella magica atmosfera del medioevo al termine delle quali verranno offerti dolci natalizi, thè caldo e vin brûlé. Quando: 24 novembre dalle 10 alle 17"
  },
  {
   "name": "Note d’Autunno alle QC Terme Dolomiti",
   "date": "05/10/2019 - 30/11/2019",
   "location": "Località\nVigo di Fassa",
   "sub_title": "Note d’Autunno alle QC Terme Dolomiti",
   "minidesc": "Suoni e sapori animano l’Aperiterme di QC Terme Dolomiti con 9 appuntamenti autunnali",
   "dates": "Periodo\n05/10/2019 - 30/11/2019",
   "category": "Tipologia\nFestival",
   "fulldesc": "Note d’Autunno alle QC Terme Dolomiti\nSuoni e sapori animano l’Aperiterme di QC Terme Dolomiti con 9 appuntamenti autunnali\nPeriodo\n05/10/2019 - 30/11/2019\nLocalità\nVigo di Fassa\nTipologia\nFestival\nI sabati d’autunno alle QC Terme Dolomiti si colorano di musica e bollicine di benessere con nove appuntamenti speciali, compresi nel biglietto d’ingresso. Dal 5 ottobre al 30 novembre i brindisi dell’Aperiterme, nell’esclusivo resort di Pozza, saranno accompagnati da eccellenze gastronomiche locali e da note di musica dal vivo."
  },
  {
   "name": "Domeniche al Museo",
   "date": "05/05/2019 - 01/12/2019",
   "location": "Località\nRiva del Garda",
   "sub_title": "Domeniche al Museo",
   "minidesc": "Entrata gratuita e visita guidata al MAG di Riva del Garda ogni prima domenica del mese",
   "dates": "Periodo\n05/05/2019 - 01/12/2019",
   "category": "Tipologia\nAltro",
   "fulldesc": "Domeniche al Museo\nEntrata gratuita e visita guidata al MAG di Riva del Garda ogni prima domenica del mese\n2 altre immagini\nPeriodo\n05/05/2019 - 01/12/2019\nLocalità\nRiva del Garda\nTipologia\nAltro\nPer il 2019, gli appuntamenti con le domeniche gratuite sono i seguenti:\n6 gennaio\n3 febbraio (solo al Museo di Riva del Garda; Galleria Civica G. Segantini chiusa)\n3 marzo (solo al Museo di Riva del Garda; Galleria Civica G. Segantini chiusa)\n7 aprile\n5 maggio\n2 giugno\n7 luglio\n4 agosto\n1 settembre\n6 ottobre (solo al Museo di Riva del Garda; Galleria Civica G. Segantini chiusa)\n3 novembre (solo al Museo di Riva del Garda; Galleria Civica G. Segantini chiusa)\n1 dicembre (solo al Museo di Riva del Garda; Galleria Civica G. Segantini chiusa)\nOrari di apertura Museo Riva del Garda:\nDal 23 marzo al 3 novembre 2019 | 10.00 - 18.00 (lunedì chiuso)\nGiugno, luglio, agosto e settembre 2019 | aperto tutti i giorni 10.00 - 18.00\n27-30 dicembre 2019 e 2-6 gennaio 2020 | 10.00 - 18.00\n31 dicembre 2019 | 10.00-17.00\nOrari di apertura Galleria Civica Segantini:\nDal 5 aprile al 15 settembre 2019 (chiusura anticipata per manutenzione - riapertura primavera 2020"
  },
  {
   "name": "1914-1918 La Gran Vera - La Grande Guerra: Galizia, Dolomiti",
   "date": "21/09/2019 - 08/12/2019",
   "location": "Località\nMoena",
   "sub_title": "1914-1918 La Gran Vera - La Grande Guerra: Galizia, Dolomiti",
   "minidesc": "Mostra-evento sulla Grande Guerra in Val di Fassa al Teatro Cinema Navalge di Moena",
   "dates": "Periodo\n21/09/2019 - 08/12/2019",
   "category": "Tipologia\nMostre",
   "fulldesc": "1914-1918 La Gran Vera - La Grande Guerra: Galizia, Dolomiti\nMostra-evento sulla Grande Guerra in Val di Fassa al Teatro Cinema Navalge di Moena\nPeriodo\n21/09/2019 - 08/12/2019\nLocalità\nMoena\nTipologia\nMostre\nL’importante esposizione, promossa da Comune di Moena, Istituto Culturale Ladino, l’associazione \"Sul fronte dei ricordi\" e curata da Michele Simonetti e Mauro Caimi, è un tesoro di documenti e cimeli divisi in quattro sezioni tematiche:\n\"Galizia 1914\", rivissuta attraverso gli straordinari quadri dei pittori di guerra austriaci, i Kriegsmaler.\n\"La trincea\", con accurate ricostruzioni di camminamenti, postazioni, grotte e diorami che rappresentano la vita vera della trincea e fanno rivivere l’atmosfera dell’epoca. Bambini e adulti hanno la possibilità di toccare alcuni oggetti, indossare elmetti, ascoltare suoni e testimonianze.\n\"Dolomiti 1915\". Le Dolomiti costituiscono ancora oggi un unico, incredibile campo di battaglia, in gran parte recuperato e visitabile: le Alte Vie Bepi Zac e Federspiel, Fango e Cima Bocche, il Lagorai, sono gioielli unici in Europa. Questi luoghi hanno restituito testimonianze straordinarie della tragica epopea che, per oltre due anni, ha visto fronteggiarsi in alta quota i combattenti di opposti eserciti. Nella sala dedicata alla Grande Guerra sul fronte dolomitico sono esposte una ventina di uniformi d’epoca, sia di parte austriaca, sia di parte italiana, illuminate in modo scenico, affiancate da vetrine tematiche con reperti della guerra in montagna, pannelli illustrativi con le testimonianze dei combattenti, foto d’epoca e testi didascalici su eventi e situazioni del fronte e delle retrovie. Nella stessa sala è possibile accedere alla \"exhibition shop\", con varia oggettistica e un’ampia esposizione di libri e pubblicazioni, utili per un approfondimento della tematica.\n\"Guerra alla Guerra\". La grande balconata sul foyer del Teatro ospita una sezione speciale sull’orrore della guerra così come appare dalle durissime immagini originali raccolte da Ernst Friedrich.\nPer maggiori info: pagina Facebook Mostra La Gran Vera Moena\nScarica la brochure della Mostra La Gran Vera in formato PDF [6,7 MB]"
  },
  {
   "name": "Matinées in Casa Mozart",
   "date": "20/10/2019 - 15/12/2019",
   "location": "Località\nRovereto",
   "sub_title": "Matinées in Casa Mozart",
   "minidesc": "Lasciati incantare dalle note di Mozart la domenica mattina",
   "dates": "Periodo\n20/10/2019 - 15/12/2019",
   "category": "Tipologia\nMusica",
   "fulldesc": "Matinées in Casa Mozart\nLasciati incantare dalle note di Mozart la domenica mattina\n2 altre immagini\nPeriodo\n20/10/2019 - 15/12/2019\nLocalità\nRovereto\nTipologia\nMusica\nDa ottobre a dicembre Casa Mozart aprirà le sue porte per accoglierti con tre appuntamenti dedicati alla musica classica.\nProgramma Domenica 20 ottobre\nore 11.00 esibizione del vincitore del Concorso “Melini 2019”, Vitaly Starikov, presso Casa Mozart\nDomenica 17 novembre\nore 11.00 esibizione integrale presso Casa Mozart dal titolo “Mozart e il pianoforte” prima parte di otto parti con Maddalena Piccirillo al pianoforte\nDomenica 15 dicembre\nore 11.00 esibizione integrale presso Casa Mozart dal titolo “Mozart e il pianoforte” seconda parte di otto parti con Nicola Ormando al pianoforte\nScopri il programma completo!"
  },
  {
   "name": "Vallarsa Estate",
   "date": "06/05/2019 - 26/12/2019",
   "location": "Località\nVallarsa",
   "sub_title": "Vallarsa Estate",
   "minidesc": "Oltre 80 appuntamenti estivi in Vallarsa",
   "dates": "Periodo\n06/05/2019 - 26/12/2019",
   "category": "Tipologia\nMostre, Conferenze/Congressi, Musica, Feste e Sagre, Enogastronomia, Intrattenimento della Località, Visite Guidate",
   "fulldesc": "Vallarsa Estate\nOltre 80 appuntamenti estivi in Vallarsa\n2 altre immagini\nPeriodo\n06/05/2019 - 26/12/2019\nLocalità\nVallarsa\nTipologia\nMostre, Conferenze/Congressi, Musica, Feste e Sagre, Enogastronomia, Intrattenimento della Località, Visite Guidate\nOccasioni di festa o riflessioni, momenti culturali o ricreativi che, come è ormai tradizione, il Comune di Vallarsa raccoglie nel calendario estivo \"Vallarsa estate\".\nUn’estate ricca di attività per adulti e bambini ti aspetta nel Comune di Vallarsa! Spaziando da concerti di musica lirica a visite guidate, a letture animate e mostre fotografiche, questi sono solo alcuni degli innumerevoli appuntamenti che non vorrai farti scappare. Immergiti nella natura con le escursioni presso i luoghi della grande guerra e le varie attività sportive, dall’arrampicata ai tornei di calcio ma anche tornei di bocce e trekking lungo i sentieri del territorio. Assapora i piatti tipici e i vini locali nelle sagre di paese e durante le camminate enogastronomiche. Lasciati infine contagiare dal ritmo delle serate karaoke e dai vari concerti organizzati. Gli eventi sono organizzati dal Comune di Vallarsa, dalla Biblioteca Comunale, dal Museo Etnografico della civiltà contadina, dalle associazioni e dal consorzio di operatori turistici della valle. Scopri il programma completo!"
  },
  {
   "name": "Visite guidate",
   "date": "30/03/2019 - 04/01/2020",
   "location": "Località\nRovereto",
   "sub_title": "Visite guidate",
   "minidesc": "Itinerari deperiani e passeggiate a tema nel centro storico di Rovereto",
   "dates": "Periodo\n30/03/2019 - 04/01/2020",
   "category": "Tipologia\nVisite Guidate",
   "fulldesc": "Visite guidate\nItinerari deperiani e passeggiate a tema nel centro storico di Rovereto\n2 altre immagini\nPeriodo\n30/03/2019 - 04/01/2020\nLocalità\nRovereto\nTipologia\nVisite Guidate\nA spasso con gli artisti Percorri le vie del centro sulle orme di Mozart e Depero. Al termine della visita, degustazione di cioccolato da Exquisita\n26 ottobre – visita con cenni a Depero\n2, 9 e 16 novembre – visita con cenni a Mozart\nItinerari Deperiani Alla scoperta del centro storico di Rovereto, sulle orme di uno dei personaggi più illustri della città.\n23 e 30 novembre\n7, 14, 21 e 28 dicembre\n4 gennaio 2020\nAl termine della visita è possibile accedere con un biglietto ridotto (4 €) alla Casa d’Arte Futurista Depero. Dove, come, quanto\nIscriviti all’Azienda per il Turismo Rovereto e Vallagarina. Se sei un possessore di Trentino Guest Card iscriviti tramite l’App per partecipare gratuitamente\nAppuntamento alle 15 nel piazzale di fronte all’Ufficio Turistico in Corso Rosmini, 21\nLe visite guidate durano circa 2 ore\nI bimbi fino a 10 anni partecipano gratis, per gli adulti il costo è di 7 euro, 5 euro per i possessori di Museum Pass\nOgni due partecipanti con biglietto d’ingresso di uno dei musei di Rovereto, per quello stesso giorno, una visita guidata è in omaggio"
  },
  {
   "name": "Pinacoteca: Testimonianze figurative dal territorio tra XIV e XIX...",
   "date": "01/06/2019 - 06/01/2020",
   "location": "Località\nRiva del Garda",
   "sub_title": "Pinacoteca: Testimonianze figurative dal territorio tra XIV e XIX secolo",
   "minidesc": "Tre sezioni permanenti dedicate alla Pinacoteca, Storia e Archeologia, mostre temporanee e visita al Mastio",
   "dates": "Periodo\n01/06/2019 - 06/01/2020",
   "category": "Tipologia\nMostre",
   "fulldesc": "Pinacoteca: Testimonianze figurative dal territorio tra XIV e XIX secolo\nTre sezioni permanenti dedicate alla Pinacoteca, Storia e Archeologia, mostre temporanee e visita al Mastio\n1 altre immagini\nPeriodo\n01/06/2019 - 06/01/2020\nLocalità\nRiva del Garda\nTipologia\nMostre\nAll'interno della Rocca di Riva del Garda, antico castello medievale a specchio sul lago, ha sede il Museo Alto Garda con le sue tre sezioni permanenti, dispiegate sui tre piani dedicati alla Pinacoteca, all'Archeologia e alla Storia, e gli spazi riservati alle mostre temporanee.\nIrrinunciabile, per chi visita il Museo, la salita al Mastio, ovvero la torre principale della Rocca da cui si apre una suggestiva immagine della città e del lago di Garda.\nLo sguardo sul paesaggio storico e contemporaneo - indagato dalle diverse angolature che comprendono le discipline della fotografia, della pittura, del disegno e della ricerca storico-scientifica - è una delle impronte più marcate che contraddistinguono l'attività espositiva e di ricerca del MAG.\nIl percorso della Pinacoteca illustra secolo dopo secolo l’evolversi della cultura figurativa in area gardesana, documentandone la peculiarità, dovuta alle molteplici influenze derivanti dalla particolare collocazione geografica, quale terra di confine.\nINvento è invece uno spazio dedicato ai bambini e alle famiglie, concepito con l’ottica dell’imparare divertendosi. Consiste in un percorso-laboratorio permanente, attrezzato con isole didattiche e giochi creativi, a cui si aggiungono la possibilità di sperimentare materiali e tecniche pittoriche e una divertente caccia al tesoro tra le opere delle collezioni.\nNei mesi di dicembre, gennaio e febbraio la Torre Apponale è chiusa.\nTARIFFE\nBiglietto Intero Museo € 5,00\nBiglietto Intero cumulativo per le 2 sedi espositive (Museo di Riva del Garda e Galleria Civica G. Segantini di Arco) € 6,00\nBiglietto Intero Torre Apponale € 2,00\nBiglietto Ridotto Museo € 2,50\nBiglietto Ridotto Torre Apponale € 1,00"
  },
  {
   "name": "Richard Artschwager",
   "date": "12/10/2019 - 02/02/2020",
   "location": "Località\nRovereto",
   "sub_title": "Richard Artschwager",
   "minidesc": "In mostra uno dei maggiori esponenti del minimalismo",
   "dates": "Periodo\n12/10/2019 - 02/02/2020",
   "category": "Tipologia\nMostre",
   "fulldesc": "Richard Artschwager\nIn mostra uno dei maggiori esponenti del minimalismo\n2 altre immagini\nPeriodo\n12/10/2019 - 02/02/2020\nLocalità\nRovereto\nTipologia\nMostre\nAffidata al curatore Germano Celant, arriva al Mart la più grande esposizione mai presentata in Europa sull’artista, pittore e scultore americano Richard Artschwager (1923-2013).\nAffidata al curatore Germano Celant, e prodotta in collaborazione con il Guggenheim Museum di Bilbao, l’esposizione sarà prima in Italia, poi in Spagna. Volta alla comprensione dello spazio, degli oggetti quotidiani e della percezione, la poetica di Artschwager si è imposta come un unicum nell’arte del secolo passato. Le sue opere affrontano la rappresentazione di strumenti utilitari riprodotti con materiali industriali come la formica, il celotex, la pittura acrilica e l’alluminio. A questi aspetti fondanti si aggiunge l'attenzione alla forma geometrica pura e all’illusionismo pittorico. Il risultato sono pitture e sculture che sospendono le categorie dell’immagine e degli oggetti in un limbo fra lo spazio che fisicamente occupano, l’utilità a cui rimandano e la rappresentazione artistica."
  },
  {
   "name": "Danzare la rivoluzione",
   "date": "19/10/2019 - 01/03/2020",
   "location": "Località\nRovereto",
   "sub_title": "Danzare la rivoluzione",
   "minidesc": "Isadora Duncan e le arti figurative in Italia tra Ottocento e avanguardia",
   "dates": "Periodo\n19/10/2019 - 01/03/2020",
   "category": "Tipologia\nMostre",
   "fulldesc": "Danzare la rivoluzione\nIsadora Duncan e le arti figurative in Italia tra Ottocento e avanguardia\nPeriodo\n19/10/2019 - 01/03/2020\nLocalità\nRovereto\nTipologia\nMostre\nArriva al Mart la prima mostra italiana dedicata alla danzatrice americana e icona culturale. Una vera e propria diva, ribelle e carismatica, che superò i canoni del balletto romantico in favore di un'autonomia di stili e tecniche.\nCentrali nel percorso espositivo sono il tema della liberazione del corpo femminile, l'influenza esercitata da Duncan nel contesto culturale del primo Novecento e il suo legame con l'Italia. Presenti in mostra le opere di numerosi grandi artisti che la rappresentarono o che ne furono profondamente ispirati: Rodin, Bourdelle, Stuck, Zandomeneghi, Sartorio, Bistolfi, Baccarini, De Carolis, Chini, Cambellotti, Nonni, Boccioni, Depero, Severini, Casorati, Campigli, Sironi, Raphaël, Gio Ponti. Una produzione a cura del Mart, della Fondazione CR Firenze, Maria Flora Giubilei e Carlo Sisi con Rossella Campana, Eleonora Barbara Nomellini e Patrizia Veroli."
  },
  {
   "name": "Lunedì Cinema Cineforum",
   "date": "14/10/2019 - 23/03/2020",
   "location": "Località\nArco, Riva del Garda",
   "sub_title": "Lunedì Cinema Cineforum",
   "minidesc": "Cineforum",
   "dates": "Periodo\n14/10/2019 - 23/03/2020",
   "category": "Tipologia\nCinema",
   "fulldesc": "Lunedì Cinema Cineforum\nCineforum\nPeriodo\n14/10/2019 - 23/03/2020\nLocalità\nArco, Riva del Garda\nTipologia\nCinema\nLe proiezioni, che iniziano alle ore 21, a Riva del Garda si tengono all’auditorium del Conservatorio e ad Arco all’auditorium di Palazzo dei Panni.\nL’ingresso avviene con tessera FIC (sottoscrivibile la sera della proiezione), che costa 12 euro (5 euro per gli studenti fino ai 25 anni d’età) ed è valida per l’intera stagione.\nL’angelo azzurro e il suo creatore Riva del Garda\n14.10 L'angelo azzurro\n21.10 Marocco\n28.10 Shanghai Express\n4.11 L'imperatrice Caterina\nLa Luna vista dalla Terra Arco\n11.11 Uomini veri\n18.11 Apollo 13\n25.11 Moon\n2.12 Space cowboys\n100 anni con Fellini Riva del Garda\n13.01 I vitelloni\n20.01 Toby Dammit | Block notes di un regista\n27.01 Fellini - Satyricon\n3.02 Roma\nRoad Movie: il genere americano per eccellenza Arco\n10.02 Easy Rider\n17.02 Punto zero\n24.02 Thelma e Louise\n2.03 Paper Moon\n50 anni senza Judy Garland Riva del Garda\n9.03 Il Mago di Oz\n16.03 Incontriamoci a Saint Louis\n23.03 Ti amavo senza saperlo"
  },
  {
   "name": "La pelle del soldato",
   "date": "25/04/2018 - 03/05/2020",
   "location": "Località\nRovereto",
   "sub_title": "La pelle del soldato",
   "minidesc": "Uniformi, corazze, elmi e maschere antigas dalla Prima guerra mondiale al Duemila",
   "dates": "Periodo\n25/04/2018 - 03/05/2020",
   "category": "Tipologia\nMostre",
   "fulldesc": "La pelle del soldato\nUniformi, corazze, elmi e maschere antigas dalla Prima guerra mondiale al Duemila\n1 altre immagini\nPeriodo\n25/04/2018 - 03/05/2020\nLocalità\nRovereto\nTipologia\nMostre\nNei conflitti del Novecento, i soldati hanno dovuto affrontare l'enorme potenziale distruttivo degli armamenti con ben pochi dispositivi di difesa e di protezione. A questo tema il Museo della Guerra dedica la mostra allestita negli spazi del Castello di Rovereto, riaperti al pubblico dopo un importante restauro. L'esposizione avrà un ampio riferimento alla Grande Guerra ma si proietterà fino agli anni Duemila, con materiali relativi alla storia più recente: dalle corazze agli elmi, dagli scudi alle maschere antigas, dalle uniformi mimetiche alle protezioni contro la minaccia nucleare, batteriologica e chimica. L'esposizione illustrerà attraverso una grande quantità di oggetti l'efficacia e i limiti delle strategie e dei dispositivi adottati dagli eserciti, rispetto alla trasformazione delle armi, alle forme e al contesto dei combattimenti, al mutare stesso delle guerre. Senza dimenticare il soggetto più indifeso delle guerre: la popolazione civile. Dove dormire #visitrovereto consiglia\nB&B Vista Castello per una vista privilegiata sul Castello di Rovereto\nOstello di Rovereto per un break nel centro storico di Rovereto"
  },
  {
   "name": "Es war einmal...Hört zu und macht mit!",
   "date": "05/10/2019 - 16/05/2020",
   "location": "Località\nRiva del Garda",
   "sub_title": "Es war einmal...Hört zu und macht mit!",
   "minidesc": "Ciclo di letture in tedesco dedicate ai bambini con Christine Rofner",
   "dates": "Periodo\n05/10/2019 - 16/05/2020",
   "category": "Tipologia\nAltro",
   "fulldesc": "Es war einmal...Hört zu und macht mit!\nCiclo di letture in tedesco dedicate ai bambini con Christine Rofner\nPeriodo\n05/10/2019 - 16/05/2020\nLocalità\nRiva del Garda\nTipologia\nAltro\nRitornano in biblioteca le letture in tedesco dedicate ai bambini dai tre anni. Un'occasione per entrare in contatto con una nuova lingua tramite l'ascolto di bellissime storie.\nOgni incontro sarà seguito da un piccolo laboratorio manuale realizzato da Christine.\nCon la collaborazione dell'Associazione Amici di Bensheim"
  },
  {
   "name": "Storylab",
   "date": "26/10/2019 - 23/05/2020",
   "location": "Località\nRiva del Garda",
   "sub_title": "Storylab",
   "minidesc": "Letture in lingua inglese per bambini dai 3 anni con Alessandra Prandi",
   "dates": "Periodo\n26/10/2019 - 23/05/2020",
   "category": "Tipologia\nAltro",
   "fulldesc": "Storylab\nLetture in lingua inglese per bambini dai 3 anni con Alessandra Prandi\nPeriodo\n26/10/2019 - 23/05/2020\nLocalità\nRiva del Garda\nTipologia\nAltro\n\"Storylab\" è condotto da Alessandra Prandi.\nSi riparte con l'attività per avvicinare i più piccoli alla lingua inglese attraverso la lettura animata di brevi racconti con l'utilizzo di piccoli oggetti e pupazzi.\nUn momento di ascolto e gioco da vivere in biblioteca guidati da Alessandra.\nOgni incontro sarà seguito da un piccolo laboratorio manuale realizzato da Alessandra Prandi.\nCALENDARIO\nSabato 26 ottobre 2019\nOre 10.30 Sala Ragazzi\nSabato 23 novembre 2019\nOre 10.30 Sala Ragazzi\nSabato 14 dicembre 2019\nOre 10.30 Sala Ragazzi\nSabato 25 gennaio 2020\nOre 10.30 Sala Ragazzi\nSabato 29 febbraio 2020\nOre 10.30 Sala Ragazzi\nSabato 21 marzo 2020\nOre 10.30 Sala Ragazzi\nSabato 2 maggio 2020\nOre 10.30 Sala Ragazzi\nSabato 23 maggio 2020\nOre 10.30 Sala Ragazzi"
  },
  {
   "name": "La Collezione Cavallini Sgarbi",
   "date": "06/06/2019 - 03/11/2019",
   "location": "Caldes"
  },
  {
   "name": "Cosmo cartoons",
   "date": "20/07/2019 - 14/06/2020",
   "location": "Trento"
  },
  {
   "name": "Trekking lungo il Sentiero della Pace",
   "date": "27/06/2019 - 17/10/2019",
   "location": "Torbole sul Garda - Nago"
  },
  {
   "name": "Volti e storie - San Martino ai Campi 1969-2019",
   "date": "26/06/2019 - 18/10/2019",
   "location": "Tenno"
  },
  {
   "name": "Ottobre a Teatro - Onesti se nasse… furbi se deventa",
   "date": "19/10/2019",
   "location": "Riva del Garda"
  },
  {
   "name": "Festa de la Golva",
   "date": "19/10/2019",
   "location": "Primiero - Sagròn Mis"
  },
  {
   "name": "Torbole Night Run",
   "date": "19/10/2019",
   "location": "Torbole sul Garda - Nago"
  },
  {
   "name": "Informatici senza frontiere",
   "date": "17/10/2019 - 19/10/2019",
   "location": "Rovereto"
  },
  {
   "name": "3° Concorso Nazionale per Cori Maschili \"Luigi Pigarelli\"",
   "date": "19/10/2019 - 20/10/2019",
   "location": "Arco"
  },
  {
   "name": "Festa del Marrone di Castione",
   "date": "19/10/2019 - 20/10/2019",
   "location": "Brentonico"
  },
  {
   "name": "Garda Trentino EMTB Adventure",
   "date": "18/10/2019 - 20/10/2019",
   "location": "Torbole sul Garda - Nago"
  },
  {
   "name": "Cammina Tesino Autunno - Sulle orme dell'orso speleo",
   "date": "13/10/2019 - 20/10/2019",
   "location": "Castello Tesino"
  },
  {
   "name": "Castagnada Biana",
   "date": "18/10/2019 - 20/10/2019",
   "location": "Albiano"
  },
  {
   "name": "Gli animali e i colori d'autunno",
   "date": "20/10/2019",
   "location": "Peio (Pejo)"
  },
  {
   "name": "Convegno Regionale FIAF",
   "date": "20/10/2019",
   "location": "Torbole sul Garda - Nago"
  },
  {
   "name": "Lago di Garda Music Festival",
   "date": "17/10/2019 - 21/10/2019",
   "location": "Riva del Garda"
  },
  {
   "name": "Trekking alle trincee del Monte Corno",
   "date": "04/06/2019 - 22/10/2019",
   "location": "Torbole sul Garda - Nago"
  },
  {
   "name": "Walking on Mart",
   "date": "27/06/2019 - 25/10/2019",
   "location": "Rovereto"
  },
  {
   "name": "Chef a Teatro",
   "date": "25/10/2019",
   "location": "Moena"
  },
  {
   "name": "Hockey su ghiaccio: Fassa Falcons vs. Vienna Capitals Silver",
   "date": "25/10/2019",
   "location": "Canazei"
  },
  {
   "name": "Ottobre a Teatro - Non dirmi che non sei felice",
   "date": "26/10/2019",
   "location": "Riva del Garda"
  },
  {
   "name": "29er Eurocup",
   "date": "23/10/2019 - 26/10/2019",
   "location": "Riva del Garda"
  },
  {
   "name": "Inanellamento scientifico degli uccelli al Passo Brocon",
   "date": "29/09/2019 - 26/10/2019",
   "location": "Passo Brocon"
  },
  {
   "name": "Hockey su ghiaccio: Fassa Falcons vs. EC Bregenzerwald",
   "date": "26/10/2019",
   "location": "Canazei"
  },
  {
   "name": "Autunno alla Haus von Prükk",
   "date": "26/10/2019",
   "location": "Luserna"
  },
  {
   "name": "Olivia Trummer & Nicola Angelucci in concerto",
   "date": "26/10/2019",
   "location": "Moena"
  },
  {
   "name": "Maroni in festa",
   "date": "27/10/2019",
   "location": "Drena"
  },
  {
   "name": "Menu Garda Ottobre d'Oro",
   "date": "12/10/2019 - 27/10/2019",
   "location": "Arco"
  },
  {
   "name": "Campionato Vela d'Altura Alto Garda",
   "date": "31/03/2019 - 27/10/2019",
   "location": "Torbole sul Garda - Nago"
  },
  {
   "name": "FORMAI DAL MONT",
   "date": "26/10/2019 - 27/10/2019",
   "location": "Tassullo"
  },
  {
   "name": "Festa della Castagna",
   "date": "26/10/2019 - 27/10/2019",
   "location": "Roncegno Terme"
  },
  {
   "name": "42^ Esposizione Ornitologica Trentina",
   "date": "26/10/2019 - 27/10/2019",
   "location": "Riva del Garda"
  },
  {
   "name": "FESTA DELLA PATATA 2019",
   "date": "25/10/2019 - 27/10/2019",
   "location": "Comano Terme"
  },
  {
   "name": "Escursione a piedi a Bosco Caproni",
   "date": "20/06/2019 - 27/10/2019",
   "location": "Arco"
  },
  {
   "name": "1° Memorial Aurelio Leoni",
   "date": "27/10/2019",
   "location": "Dro"
  },
  {
   "name": "Olio che bontà",
   "date": "26/10/2019 - 27/10/2019",
   "location": "Torbole sul Garda - Nago"
  },
  {
   "name": "Nago in movimento",
   "date": "27/10/2019",
   "location": "Torbole sul Garda - Nago"
  },
  {
   "name": "Armate in Miniatura",
   "date": "20/04/2019 - 30/10/2019",
   "location": "Torbole sul Garda - Nago"
  },
  {
   "name": "Armate in miniatura",
   "date": "20/04/2019 - 30/10/2019",
   "location": "Rovereto"
  },
  {
   "name": "DiVin Ottobre",
   "date": "04/10/2019 - 31/10/2019",
   "location": "Grumes"
  },
  {
   "name": "Halloween Trash Party",
   "date": "31/10/2019",
   "location": "Arco"
  },
  {
   "name": "Shopping aspettando Halloween",
   "date": "26/10/2019 - 31/10/2019",
   "location": "Rovereto"
  },
  {
   "name": "Cinema ad Arco",
   "date": "05/10/2019 - 31/10/2019",
   "location": "Arco"
  },
  {
   "name": "Trekking sul Monte Colodri e sul Monte Colt",
   "date": "13/06/2019 - 31/10/2019",
   "location": "Arco"
  },
  {
   "name": "Il Sacro e il Quotidiano. Il villaggio tardoantico a San Martino ai...",
   "date": "04/10/2019 - 01/11/2019",
   "location": "Riva del Garda"
  },
  {
   "name": "Forte Pozzacchio: eventi e aperture",
   "date": "01/06/2019 - 03/11/2019",
   "location": "Trambileno"
  },
  {
   "name": "ANTICHI SAPORI DELLA VAL DI NON",
   "date": "18/10/2019 - 03/11/2019",
   "location": "Cles"
  },
  {
   "name": "Fratello Lupo",
   "date": "30/03/2019 - 03/11/2019",
   "location": "Luserna"
  },
  {
   "name": "La forma dello Sport",
   "date": "14/04/2019 - 03/11/2019",
   "location": "Riva del Garda"
  },
  {
   "name": "La ferita della bellezza. Alberto Burri e il Grande Cretto di...",
   "date": "22/06/2019 - 03/11/2019",
   "location": "Riva del Garda"
  },
  {
   "name": "URSUS - STORIE DI UOMINI E DI ORSI",
   "date": "06/07/2019 - 03/11/2019",
   "location": "Cles"
  },
  {
   "name": "La Grande mostra fotografica del popolo",
   "date": "28/09/2019 - 07/11/2019",
   "location": "Arco"
  },
  {
   "name": "Incontri di Analisi e Composizione",
   "date": "26/04/2019 - 08/11/2019",
   "location": "Riva del Garda"
  },
  {
   "name": "Parigi. Artisti trentini 1900-1989",
   "date": "21/09/2019 - 10/11/2019",
   "location": "Tenno"
  },
  {
   "name": "Festival Giallo Garda",
   "date": "19/10/2019 - 15/11/2019",
   "location": "Riva del Garda"
  },
  {
   "name": "Artisti per Arrigo",
   "date": "28/09/2019 - 20/11/2019",
   "location": "Riva del Garda"
  },
  {
   "name": "Castello di Avio per famiglie",
   "date": "22/04/2019 - 24/11/2019",
   "location": "Avio"
  },
  {
   "name": "Note d’Autunno alle QC Terme Dolomiti",
   "date": "05/10/2019 - 30/11/2019",
   "location": "Vigo di Fassa"
  },
  {
   "name": "Domeniche al Museo",
   "date": "05/05/2019 - 01/12/2019",
   "location": "Riva del Garda"
  },
  {
   "name": "1914-1918 La Gran Vera - La Grande Guerra: Galizia, Dolomiti",
   "date": "21/09/2019 - 08/12/2019",
   "location": "Moena"
  },
  {
   "name": "Matinées in Casa Mozart",
   "date": "20/10/2019 - 15/12/2019",
   "location": "Rovereto"
  },
  {
   "name": "Vallarsa Estate",
   "date": "06/05/2019 - 26/12/2019",
   "location": "Vallarsa"
  },
  {
   "name": "Visite guidate",
   "date": "30/03/2019 - 04/01/2020",
   "location": "Rovereto"
  },
  {
   "name": "Pinacoteca: Testimonianze figurative dal territorio tra XIV e XIX...",
   "date": "01/06/2019 - 06/01/2020",
   "location": "Riva del Garda"
  },
  {
   "name": "Richard Artschwager",
   "date": "12/10/2019 - 02/02/2020",
   "location": "Rovereto"
  },
  {
   "name": "Danzare la rivoluzione",
   "date": "19/10/2019 - 01/03/2020",
   "location": "Rovereto"
  },
  {
   "name": "Lunedì Cinema Cineforum",
   "date": "14/10/2019 - 23/03/2020",
   "location": "Arco"
  },
  {
   "name": "La pelle del soldato",
   "date": "25/04/2018 - 03/05/2020",
   "location": "Rovereto"
  },
  {
   "name": "Es war einmal...Hört zu und macht mit!",
   "date": "05/10/2019 - 16/05/2020",
   "location": "Riva del Garda"
  },
  {
   "name": "Storylab",
   "date": "26/10/2019 - 23/05/2020",
   "location": "Riva del Garda"
  },
  {
   "name": "La Collezione Cavallini Sgarbi",
   "date": "06/06/2019 - 03/11/2019",
   "location": "Caldes"
  },
  {
   "name": "Cosmo cartoons",
   "date": "20/07/2019 - 14/06/2020",
   "location": "Trento"
  },
  {
   "name": "Trekking lungo il Sentiero della Pace",
   "date": "27/06/2019 - 17/10/2019",
   "location": "Torbole sul Garda - Nago"
  },
  {
   "name": "Volti e storie - San Martino ai Campi 1969-2019",
   "date": "26/06/2019 - 18/10/2019",
   "location": "Tenno"
  },
  {
   "name": "Ottobre a Teatro - Onesti se nasse… furbi se deventa",
   "date": "19/10/2019",
   "location": "Riva del Garda"
  },
  {
   "name": "Festa de la Golva",
   "date": "19/10/2019",
   "location": "Primiero - Sagròn Mis"
  },
  {
   "name": "Torbole Night Run",
   "date": "19/10/2019",
   "location": "Torbole sul Garda - Nago"
  },
  {
   "name": "Informatici senza frontiere",
   "date": "17/10/2019 - 19/10/2019",
   "location": "Rovereto"
  },
  {
   "name": "3° Concorso Nazionale per Cori Maschili \"Luigi Pigarelli\"",
   "date": "19/10/2019 - 20/10/2019",
   "location": "Arco"
  },
  {
   "name": "Festa del Marrone di Castione",
   "date": "19/10/2019 - 20/10/2019",
   "location": "Brentonico"
  },
  {
   "name": "Garda Trentino EMTB Adventure",
   "date": "18/10/2019 - 20/10/2019",
   "location": "Torbole sul Garda - Nago"
  },
  {
   "name": "Cammina Tesino Autunno - Sulle orme dell'orso speleo",
   "date": "13/10/2019 - 20/10/2019",
   "location": "Castello Tesino"
  },
  {
   "name": "Castagnada Biana",
   "date": "18/10/2019 - 20/10/2019",
   "location": "Albiano"
  },
  {
   "name": "Gli animali e i colori d'autunno",
   "date": "20/10/2019",
   "location": "Peio (Pejo)"
  },
  {
   "name": "Convegno Regionale FIAF",
   "date": "20/10/2019",
   "location": "Torbole sul Garda - Nago"
  },
  {
   "name": "Lago di Garda Music Festival",
   "date": "17/10/2019 - 21/10/2019",
   "location": "Riva del Garda"
  },
  {
   "name": "Trekking alle trincee del Monte Corno",
   "date": "04/06/2019 - 22/10/2019",
   "location": "Torbole sul Garda - Nago"
  },
  {
   "name": "Walking on Mart",
   "date": "27/06/2019 - 25/10/2019",
   "location": "Rovereto"
  },
  {
   "name": "Chef a Teatro",
   "date": "25/10/2019",
   "location": "Moena"
  },
  {
   "name": "Hockey su ghiaccio: Fassa Falcons vs. Vienna Capitals Silver",
   "date": "25/10/2019",
   "location": "Canazei"
  },
  {
   "name": "Ottobre a Teatro - Non dirmi che non sei felice",
   "date": "26/10/2019",
   "location": "Riva del Garda"
  },
  {
   "name": "29er Eurocup",
   "date": "23/10/2019 - 26/10/2019",
   "location": "Riva del Garda"
  },
  {
   "name": "Inanellamento scientifico degli uccelli al Passo Brocon",
   "date": "29/09/2019 - 26/10/2019",
   "location": "Passo Brocon"
  },
  {
   "name": "Hockey su ghiaccio: Fassa Falcons vs. EC Bregenzerwald",
   "date": "26/10/2019",
   "location": "Canazei"
  },
  {
   "name": "Autunno alla Haus von Prükk",
   "date": "26/10/2019",
   "location": "Luserna"
  },
  {
   "name": "Olivia Trummer & Nicola Angelucci in concerto",
   "date": "26/10/2019",
   "location": "Moena"
  },
  {
   "name": "Maroni in festa",
   "date": "27/10/2019",
   "location": "Drena"
  },
  {
   "name": "Menu Garda Ottobre d'Oro",
   "date": "12/10/2019 - 27/10/2019",
   "location": "Arco"
  },
  {
   "name": "Campionato Vela d'Altura Alto Garda",
   "date": "31/03/2019 - 27/10/2019",
   "location": "Torbole sul Garda - Nago"
  },
  {
   "name": "FORMAI DAL MONT",
   "date": "26/10/2019 - 27/10/2019",
   "location": "Tassullo"
  },
  {
   "name": "Festa della Castagna",
   "date": "26/10/2019 - 27/10/2019",
   "location": "Roncegno Terme"
  },
  {
   "name": "42^ Esposizione Ornitologica Trentina",
   "date": "26/10/2019 - 27/10/2019",
   "location": "Riva del Garda"
  },
  {
   "name": "FESTA DELLA PATATA 2019",
   "date": "25/10/2019 - 27/10/2019",
   "location": "Comano Terme"
  },
  {
   "name": "Escursione a piedi a Bosco Caproni",
   "date": "20/06/2019 - 27/10/2019",
   "location": "Arco"
  },
  {
   "name": "1° Memorial Aurelio Leoni",
   "date": "27/10/2019",
   "location": "Dro"
  },
  {
   "name": "Olio che bontà",
   "date": "26/10/2019 - 27/10/2019",
   "location": "Torbole sul Garda - Nago"
  },
  {
   "name": "Nago in movimento",
   "date": "27/10/2019",
   "location": "Torbole sul Garda - Nago"
  },
  {
   "name": "Armate in Miniatura",
   "date": "20/04/2019 - 30/10/2019",
   "location": "Torbole sul Garda - Nago"
  },
  {
   "name": "Armate in miniatura",
   "date": "20/04/2019 - 30/10/2019",
   "location": "Rovereto"
  },
  {
   "name": "DiVin Ottobre",
   "date": "04/10/2019 - 31/10/2019",
   "location": "Grumes"
  },
  {
   "name": "Halloween Trash Party",
   "date": "31/10/2019",
   "location": "Arco"
  },
  {
   "name": "Shopping aspettando Halloween",
   "date": "26/10/2019 - 31/10/2019",
   "location": "Rovereto"
  },
  {
   "name": "Cinema ad Arco",
   "date": "05/10/2019 - 31/10/2019",
   "location": "Arco"
  },
  {
   "name": "Trekking sul Monte Colodri e sul Monte Colt",
   "date": "13/06/2019 - 31/10/2019",
   "location": "Arco"
  },
  {
   "name": "Il Sacro e il Quotidiano. Il villaggio tardoantico a San Martino ai...",
   "date": "04/10/2019 - 01/11/2019",
   "location": "Riva del Garda"
  },
  {
   "name": "Forte Pozzacchio: eventi e aperture",
   "date": "01/06/2019 - 03/11/2019",
   "location": "Trambileno"
  },
  {
   "name": "ANTICHI SAPORI DELLA VAL DI NON",
   "date": "18/10/2019 - 03/11/2019",
   "location": "Cles"
  },
  {
   "name": "Fratello Lupo",
   "date": "30/03/2019 - 03/11/2019",
   "location": "Luserna"
  },
  {
   "name": "La forma dello Sport",
   "date": "14/04/2019 - 03/11/2019",
   "location": "Riva del Garda"
  },
  {
   "name": "La ferita della bellezza. Alberto Burri e il Grande Cretto di...",
   "date": "22/06/2019 - 03/11/2019",
   "location": "Riva del Garda"
  },
  {
   "name": "URSUS - STORIE DI UOMINI E DI ORSI",
   "date": "06/07/2019 - 03/11/2019",
   "location": "Cles"
  },
  {
   "name": "La Grande mostra fotografica del popolo",
   "date": "28/09/2019 - 07/11/2019",
   "location": "Arco"
  },
  {
   "name": "Incontri di Analisi e Composizione",
   "date": "26/04/2019 - 08/11/2019",
   "location": "Riva del Garda"
  },
  {
   "name": "Parigi. Artisti trentini 1900-1989",
   "date": "21/09/2019 - 10/11/2019",
   "location": "Tenno"
  },
  {
   "name": "Festival Giallo Garda",
   "date": "19/10/2019 - 15/11/2019",
   "location": "Riva del Garda"
  },
  {
   "name": "Artisti per Arrigo",
   "date": "28/09/2019 - 20/11/2019",
   "location": "Riva del Garda"
  },
  {
   "name": "Castello di Avio per famiglie",
   "date": "22/04/2019 - 24/11/2019",
   "location": "Avio"
  },
  {
   "name": "Note d’Autunno alle QC Terme Dolomiti",
   "date": "05/10/2019 - 30/11/2019",
   "location": "Vigo di Fassa"
  },
  {
   "name": "Domeniche al Museo",
   "date": "05/05/2019 - 01/12/2019",
   "location": "Riva del Garda"
  },
  {
   "name": "1914-1918 La Gran Vera - La Grande Guerra: Galizia, Dolomiti",
   "date": "21/09/2019 - 08/12/2019",
   "location": "Moena"
  },
  {
   "name": "Matinées in Casa Mozart",
   "date": "20/10/2019 - 15/12/2019",
   "location": "Rovereto"
  },
  {
   "name": "Vallarsa Estate",
   "date": "06/05/2019 - 26/12/2019",
   "location": "Vallarsa"
  },
  {
   "name": "Visite guidate",
   "date": "30/03/2019 - 04/01/2020",
   "location": "Rovereto"
  },
  {
   "name": "Pinacoteca: Testimonianze figurative dal territorio tra XIV e XIX...",
   "date": "01/06/2019 - 06/01/2020",
   "location": "Riva del Garda"
  },
  {
   "name": "Richard Artschwager",
   "date": "12/10/2019 - 02/02/2020",
   "location": "Rovereto"
  },
  {
   "name": "Danzare la rivoluzione",
   "date": "19/10/2019 - 01/03/2020",
   "location": "Rovereto"
  },
  {
   "name": "Lunedì Cinema Cineforum",
   "date": "14/10/2019 - 23/03/2020",
   "location": "Arco"
  },
  {
   "name": "La pelle del soldato",
   "date": "25/04/2018 - 03/05/2020",
   "location": "Rovereto"
  },
  {
   "name": "Es war einmal...Hört zu und macht mit!",
   "date": "05/10/2019 - 16/05/2020",
   "location": "Riva del Garda"
  },
  {
   "name": "Storylab",
   "date": "26/10/2019 - 23/05/2020",
   "location": "Riva del Garda"
  },
  {
   "name": "La Collezione Cavallini Sgarbi",
   "date": "06/06/2019 - 03/11/2019",
   "location": "Caldes"
  },
  {
   "name": "Cosmo cartoons",
   "date": "20/07/2019 - 14/06/2020",
   "location": "Trento"
  },
  {
   "name": "Trekking lungo il Sentiero della Pace",
   "date": "27/06/2019 - 17/10/2019",
   "location": "Torbole sul Garda - Nago"
  },
  {
   "name": "Volti e storie - San Martino ai Campi 1969-2019",
   "date": "26/06/2019 - 18/10/2019",
   "location": "Tenno"
  },
  {
   "name": "Ottobre a Teatro - Onesti se nasse… furbi se deventa",
   "date": "19/10/2019",
   "location": "Riva del Garda"
  },
  {
   "name": "Festa de la Golva",
   "date": "19/10/2019",
   "location": "Primiero - Sagròn Mis"
  },
  {
   "name": "Torbole Night Run",
   "date": "19/10/2019",
   "location": "Torbole sul Garda - Nago"
  },
  {
   "name": "Informatici senza frontiere",
   "date": "17/10/2019 - 19/10/2019",
   "location": "Rovereto"
  },
  {
   "name": "3° Concorso Nazionale per Cori Maschili \"Luigi Pigarelli\"",
   "date": "19/10/2019 - 20/10/2019",
   "location": "Arco"
  },
  {
   "name": "Festa del Marrone di Castione",
   "date": "19/10/2019 - 20/10/2019",
   "location": "Brentonico"
  },
  {
   "name": "Garda Trentino EMTB Adventure",
   "date": "18/10/2019 - 20/10/2019",
   "location": "Torbole sul Garda - Nago"
  },
  {
   "name": "Cammina Tesino Autunno - Sulle orme dell'orso speleo",
   "date": "13/10/2019 - 20/10/2019",
   "location": "Castello Tesino"
  },
  {
   "name": "Castagnada Biana",
   "date": "18/10/2019 - 20/10/2019",
   "location": "Albiano"
  },
  {
   "name": "Gli animali e i colori d'autunno",
   "date": "20/10/2019",
   "location": "Peio (Pejo)"
  },
  {
   "name": "Convegno Regionale FIAF",
   "date": "20/10/2019",
   "location": "Torbole sul Garda - Nago"
  },
  {
   "name": "Lago di Garda Music Festival",
   "date": "17/10/2019 - 21/10/2019",
   "location": "Riva del Garda"
  },
  {
   "name": "Trekking alle trincee del Monte Corno",
   "date": "04/06/2019 - 22/10/2019",
   "location": "Torbole sul Garda - Nago"
  },
  {
   "name": "Walking on Mart",
   "date": "27/06/2019 - 25/10/2019",
   "location": "Rovereto"
  },
  {
   "name": "Chef a Teatro",
   "date": "25/10/2019",
   "location": "Moena"
  },
  {
   "name": "Hockey su ghiaccio: Fassa Falcons vs. Vienna Capitals Silver",
   "date": "25/10/2019",
   "location": "Canazei"
  },
  {
   "name": "Ottobre a Teatro - Non dirmi che non sei felice",
   "date": "26/10/2019",
   "location": "Riva del Garda"
  },
  {
   "name": "29er Eurocup",
   "date": "23/10/2019 - 26/10/2019",
   "location": "Riva del Garda"
  },
  {
   "name": "Inanellamento scientifico degli uccelli al Passo Brocon",
   "date": "29/09/2019 - 26/10/2019",
   "location": "Passo Brocon"
  },
  {
   "name": "Hockey su ghiaccio: Fassa Falcons vs. EC Bregenzerwald",
   "date": "26/10/2019",
   "location": "Canazei"
  },
  {
   "name": "Autunno alla Haus von Prükk",
   "date": "26/10/2019",
   "location": "Luserna"
  },
  {
   "name": "Olivia Trummer & Nicola Angelucci in concerto",
   "date": "26/10/2019",
   "location": "Moena"
  },
  {
   "name": "Maroni in festa",
   "date": "27/10/2019",
   "location": "Drena"
  },
  {
   "name": "Menu Garda Ottobre d'Oro",
   "date": "12/10/2019 - 27/10/2019",
   "location": "Arco"
  },
  {
   "name": "Campionato Vela d'Altura Alto Garda",
   "date": "31/03/2019 - 27/10/2019",
   "location": "Torbole sul Garda - Nago"
  },
  {
   "name": "FORMAI DAL MONT",
   "date": "26/10/2019 - 27/10/2019",
   "location": "Tassullo"
  },
  {
   "name": "Festa della Castagna",
   "date": "26/10/2019 - 27/10/2019",
   "location": "Roncegno Terme"
  },
  {
   "name": "42^ Esposizione Ornitologica Trentina",
   "date": "26/10/2019 - 27/10/2019",
   "location": "Riva del Garda"
  },
  {
   "name": "FESTA DELLA PATATA 2019",
   "date": "25/10/2019 - 27/10/2019",
   "location": "Comano Terme"
  },
  {
   "name": "Escursione a piedi a Bosco Caproni",
   "date": "20/06/2019 - 27/10/2019",
   "location": "Arco"
  },
  {
   "name": "1° Memorial Aurelio Leoni",
   "date": "27/10/2019",
   "location": "Dro"
  },
  {
   "name": "Olio che bontà",
   "date": "26/10/2019 - 27/10/2019",
   "location": "Torbole sul Garda - Nago"
  },
  {
   "name": "Nago in movimento",
   "date": "27/10/2019",
   "location": "Torbole sul Garda - Nago"
  },
  {
   "name": "Armate in Miniatura",
   "date": "20/04/2019 - 30/10/2019",
   "location": "Torbole sul Garda - Nago"
  },
  {
   "name": "Armate in miniatura",
   "date": "20/04/2019 - 30/10/2019",
   "location": "Rovereto"
  },
  {
   "name": "DiVin Ottobre",
   "date": "04/10/2019 - 31/10/2019",
   "location": "Grumes"
  },
  {
   "name": "Halloween Trash Party",
   "date": "31/10/2019",
   "location": "Arco"
  },
  {
   "name": "Shopping aspettando Halloween",
   "date": "26/10/2019 - 31/10/2019",
   "location": "Rovereto"
  },
  {
   "name": "Cinema ad Arco",
   "date": "05/10/2019 - 31/10/2019",
   "location": "Arco"
  },
  {
   "name": "Trekking sul Monte Colodri e sul Monte Colt",
   "date": "13/06/2019 - 31/10/2019",
   "location": "Arco"
  },
  {
   "name": "Il Sacro e il Quotidiano. Il villaggio tardoantico a San Martino ai...",
   "date": "04/10/2019 - 01/11/2019",
   "location": "Riva del Garda"
  },
  {
   "name": "Forte Pozzacchio: eventi e aperture",
   "date": "01/06/2019 - 03/11/2019",
   "location": "Trambileno"
  },
  {
   "name": "ANTICHI SAPORI DELLA VAL DI NON",
   "date": "18/10/2019 - 03/11/2019",
   "location": "Cles"
  },
  {
   "name": "Fratello Lupo",
   "date": "30/03/2019 - 03/11/2019",
   "location": "Luserna"
  },
  {
   "name": "La forma dello Sport",
   "date": "14/04/2019 - 03/11/2019",
   "location": "Riva del Garda"
  },
  {
   "name": "La ferita della bellezza. Alberto Burri e il Grande Cretto di...",
   "date": "22/06/2019 - 03/11/2019",
   "location": "Riva del Garda"
  },
  {
   "name": "URSUS - STORIE DI UOMINI E DI ORSI",
   "date": "06/07/2019 - 03/11/2019",
   "location": "Cles"
  },
  {
   "name": "La Grande mostra fotografica del popolo",
   "date": "28/09/2019 - 07/11/2019",
   "location": "Arco"
  },
  {
   "name": "Incontri di Analisi e Composizione",
   "date": "26/04/2019 - 08/11/2019",
   "location": "Riva del Garda"
  },
  {
   "name": "Parigi. Artisti trentini 1900-1989",
   "date": "21/09/2019 - 10/11/2019",
   "location": "Tenno"
  },
  {
   "name": "Festival Giallo Garda",
   "date": "19/10/2019 - 15/11/2019",
   "location": "Riva del Garda"
  },
  {
   "name": "Artisti per Arrigo",
   "date": "28/09/2019 - 20/11/2019",
   "location": "Riva del Garda"
  },
  {
   "name": "Castello di Avio per famiglie",
   "date": "22/04/2019 - 24/11/2019",
   "location": "Avio"
  },
  {
   "name": "Note d’Autunno alle QC Terme Dolomiti",
   "date": "05/10/2019 - 30/11/2019",
   "location": "Vigo di Fassa"
  },
  {
   "name": "Domeniche al Museo",
   "date": "05/05/2019 - 01/12/2019",
   "location": "Riva del Garda"
  },
  {
   "name": "1914-1918 La Gran Vera - La Grande Guerra: Galizia, Dolomiti",
   "date": "21/09/2019 - 08/12/2019",
   "location": "Moena"
  },
  {
   "name": "Matinées in Casa Mozart",
   "date": "20/10/2019 - 15/12/2019",
   "location": "Rovereto"
  },
  {
   "name": "Vallarsa Estate",
   "date": "06/05/2019 - 26/12/2019",
   "location": "Vallarsa"
  },
  {
   "name": "Visite guidate",
   "date": "30/03/2019 - 04/01/2020",
   "location": "Rovereto"
  },
  {
   "name": "Pinacoteca: Testimonianze figurative dal territorio tra XIV e XIX...",
   "date": "01/06/2019 - 06/01/2020",
   "location": "Riva del Garda"
  },
  {
   "name": "Richard Artschwager",
   "date": "12/10/2019 - 02/02/2020",
   "location": "Rovereto"
  },
  {
   "name": "Danzare la rivoluzione",
   "date": "19/10/2019 - 01/03/2020",
   "location": "Rovereto"
  },
  {
   "name": "Lunedì Cinema Cineforum",
   "date": "14/10/2019 - 23/03/2020",
   "location": "Arco"
  },
  {
   "name": "La pelle del soldato",
   "date": "25/04/2018 - 03/05/2020",
   "location": "Rovereto"
  },
  {
   "name": "Es war einmal...Hört zu und macht mit!",
   "date": "05/10/2019 - 16/05/2020",
   "location": "Riva del Garda"
  },
  {
   "name": "Storylab",
   "date": "26/10/2019 - 23/05/2020",
   "location": "Riva del Garda"
  },
  {
   "name": "La Collezione Cavallini Sgarbi",
   "date": "06/06/2019 - 03/11/2019",
   "location": "Caldes"
  },
  {
   "name": "Cosmo cartoons",
   "date": "20/07/2019 - 14/06/2020",
   "location": "Trento"
  },
  {
   "name": "Trekking lungo il Sentiero della Pace",
   "date": "27/06/2019 - 17/10/2019",
   "location": "Torbole sul Garda - Nago"
  },
  {
   "name": "Volti e storie - San Martino ai Campi 1969-2019",
   "date": "26/06/2019 - 18/10/2019",
   "location": "Tenno"
  },
  {
   "name": "Ottobre a Teatro - Onesti se nasse… furbi se deventa",
   "date": "19/10/2019",
   "location": "Riva del Garda"
  },
  {
   "name": "Festa de la Golva",
   "date": "19/10/2019",
   "location": "Primiero - Sagròn Mis"
  },
  {
   "name": "Torbole Night Run",
   "date": "19/10/2019",
   "location": "Torbole sul Garda - Nago"
  },
  {
   "name": "Informatici senza frontiere",
   "date": "17/10/2019 - 19/10/2019",
   "location": "Rovereto"
  },
  {
   "name": "3° Concorso Nazionale per Cori Maschili \"Luigi Pigarelli\"",
   "date": "19/10/2019 - 20/10/2019",
   "location": "Arco"
  },
  {
   "name": "Festa del Marrone di Castione",
   "date": "19/10/2019 - 20/10/2019",
   "location": "Brentonico"
  },
  {
   "name": "Garda Trentino EMTB Adventure",
   "date": "18/10/2019 - 20/10/2019",
   "location": "Torbole sul Garda - Nago"
  },
  {
   "name": "Cammina Tesino Autunno - Sulle orme dell'orso speleo",
   "date": "13/10/2019 - 20/10/2019",
   "location": "Castello Tesino"
  },
  {
   "name": "Castagnada Biana",
   "date": "18/10/2019 - 20/10/2019",
   "location": "Albiano"
  },
  {
   "name": "Gli animali e i colori d'autunno",
   "date": "20/10/2019",
   "location": "Peio (Pejo)"
  },
  {
   "name": "Convegno Regionale FIAF",
   "date": "20/10/2019",
   "location": "Torbole sul Garda - Nago"
  },
  {
   "name": "Lago di Garda Music Festival",
   "date": "17/10/2019 - 21/10/2019",
   "location": "Riva del Garda"
  },
  {
   "name": "Trekking alle trincee del Monte Corno",
   "date": "04/06/2019 - 22/10/2019",
   "location": "Torbole sul Garda - Nago"
  },
  {
   "name": "Walking on Mart",
   "date": "27/06/2019 - 25/10/2019",
   "location": "Rovereto"
  },
  {
   "name": "Chef a Teatro",
   "date": "25/10/2019",
   "location": "Moena"
  },
  {
   "name": "Hockey su ghiaccio: Fassa Falcons vs. Vienna Capitals Silver",
   "date": "25/10/2019",
   "location": "Canazei"
  },
  {
   "name": "Ottobre a Teatro - Non dirmi che non sei felice",
   "date": "26/10/2019",
   "location": "Riva del Garda"
  },
  {
   "name": "29er Eurocup",
   "date": "23/10/2019 - 26/10/2019",
   "location": "Riva del Garda"
  },
  {
   "name": "Inanellamento scientifico degli uccelli al Passo Brocon",
   "date": "29/09/2019 - 26/10/2019",
   "location": "Passo Brocon"
  },
  {
   "name": "Hockey su ghiaccio: Fassa Falcons vs. EC Bregenzerwald",
   "date": "26/10/2019",
   "location": "Canazei"
  },
  {
   "name": "Autunno alla Haus von Prükk",
   "date": "26/10/2019",
   "location": "Luserna"
  },
  {
   "name": "Olivia Trummer & Nicola Angelucci in concerto",
   "date": "26/10/2019",
   "location": "Moena"
  },
  {
   "name": "Maroni in festa",
   "date": "27/10/2019",
   "location": "Drena"
  },
  {
   "name": "Menu Garda Ottobre d'Oro",
   "date": "12/10/2019 - 27/10/2019",
   "location": "Arco"
  },
  {
   "name": "Campionato Vela d'Altura Alto Garda",
   "date": "31/03/2019 - 27/10/2019",
   "location": "Torbole sul Garda - Nago"
  },
  {
   "name": "FORMAI DAL MONT",
   "date": "26/10/2019 - 27/10/2019",
   "location": "Tassullo"
  },
  {
   "name": "Festa della Castagna",
   "date": "26/10/2019 - 27/10/2019",
   "location": "Roncegno Terme"
  },
  {
   "name": "42^ Esposizione Ornitologica Trentina",
   "date": "26/10/2019 - 27/10/2019",
   "location": "Riva del Garda"
  },
  {
   "name": "FESTA DELLA PATATA 2019",
   "date": "25/10/2019 - 27/10/2019",
   "location": "Comano Terme"
  },
  {
   "name": "Escursione a piedi a Bosco Caproni",
   "date": "20/06/2019 - 27/10/2019",
   "location": "Arco"
  },
  {
   "name": "1° Memorial Aurelio Leoni",
   "date": "27/10/2019",
   "location": "Dro"
  },
  {
   "name": "Olio che bontà",
   "date": "26/10/2019 - 27/10/2019",
   "location": "Torbole sul Garda - Nago"
  },
  {
   "name": "Nago in movimento",
   "date": "27/10/2019",
   "location": "Torbole sul Garda - Nago"
  },
  {
   "name": "Armate in Miniatura",
   "date": "20/04/2019 - 30/10/2019",
   "location": "Torbole sul Garda - Nago"
  },
  {
   "name": "Armate in miniatura",
   "date": "20/04/2019 - 30/10/2019",
   "location": "Rovereto"
  },
  {
   "name": "DiVin Ottobre",
   "date": "04/10/2019 - 31/10/2019",
   "location": "Grumes"
  },
  {
   "name": "Halloween Trash Party",
   "date": "31/10/2019",
   "location": "Arco"
  },
  {
   "name": "Shopping aspettando Halloween",
   "date": "26/10/2019 - 31/10/2019",
   "location": "Rovereto"
  },
  {
   "name": "Cinema ad Arco",
   "date": "05/10/2019 - 31/10/2019",
   "location": "Arco"
  },
  {
   "name": "Trekking sul Monte Colodri e sul Monte Colt",
   "date": "13/06/2019 - 31/10/2019",
   "location": "Arco"
  },
  {
   "name": "Il Sacro e il Quotidiano. Il villaggio tardoantico a San Martino ai...",
   "date": "04/10/2019 - 01/11/2019",
   "location": "Riva del Garda"
  },
  {
   "name": "Forte Pozzacchio: eventi e aperture",
   "date": "01/06/2019 - 03/11/2019",
   "location": "Trambileno"
  },
  {
   "name": "ANTICHI SAPORI DELLA VAL DI NON",
   "date": "18/10/2019 - 03/11/2019",
   "location": "Cles"
  },
  {
   "name": "Fratello Lupo",
   "date": "30/03/2019 - 03/11/2019",
   "location": "Luserna"
  },
  {
   "name": "La forma dello Sport",
   "date": "14/04/2019 - 03/11/2019",
   "location": "Riva del Garda"
  },
  {
   "name": "La ferita della bellezza. Alberto Burri e il Grande Cretto di...",
   "date": "22/06/2019 - 03/11/2019",
   "location": "Riva del Garda"
  },
  {
   "name": "URSUS - STORIE DI UOMINI E DI ORSI",
   "date": "06/07/2019 - 03/11/2019",
   "location": "Cles"
  },
  {
   "name": "La Grande mostra fotografica del popolo",
   "date": "28/09/2019 - 07/11/2019",
   "location": "Arco"
  },
  {
   "name": "Incontri di Analisi e Composizione",
   "date": "26/04/2019 - 08/11/2019",
   "location": "Riva del Garda"
  },
  {
   "name": "Parigi. Artisti trentini 1900-1989",
   "date": "21/09/2019 - 10/11/2019",
   "location": "Tenno"
  },
  {
   "name": "Festival Giallo Garda",
   "date": "19/10/2019 - 15/11/2019",
   "location": "Riva del Garda"
  },
  {
   "name": "Artisti per Arrigo",
   "date": "28/09/2019 - 20/11/2019",
   "location": "Riva del Garda"
  },
  {
   "name": "Castello di Avio per famiglie",
   "date": "22/04/2019 - 24/11/2019",
   "location": "Avio"
  },
  {
   "name": "Note d’Autunno alle QC Terme Dolomiti",
   "date": "05/10/2019 - 30/11/2019",
   "location": "Vigo di Fassa"
  },
  {
   "name": "Domeniche al Museo",
   "date": "05/05/2019 - 01/12/2019",
   "location": "Riva del Garda"
  },
  {
   "name": "1914-1918 La Gran Vera - La Grande Guerra: Galizia, Dolomiti",
   "date": "21/09/2019 - 08/12/2019",
   "location": "Moena"
  },
  {
   "name": "Matinées in Casa Mozart",
   "date": "20/10/2019 - 15/12/2019",
   "location": "Rovereto"
  },
  {
   "name": "Vallarsa Estate",
   "date": "06/05/2019 - 26/12/2019",
   "location": "Vallarsa"
  },
  {
   "name": "Visite guidate",
   "date": "30/03/2019 - 04/01/2020",
   "location": "Rovereto"
  },
  {
   "name": "Pinacoteca: Testimonianze figurative dal territorio tra XIV e XIX...",
   "date": "01/06/2019 - 06/01/2020",
   "location": "Riva del Garda"
  },
  {
   "name": "Richard Artschwager",
   "date": "12/10/2019 - 02/02/2020",
   "location": "Rovereto"
  },
  {
   "name": "Danzare la rivoluzione",
   "date": "19/10/2019 - 01/03/2020",
   "location": "Rovereto"
  },
  {
   "name": "Lunedì Cinema Cineforum",
   "date": "14/10/2019 - 23/03/2020",
   "location": "Arco"
  },
  {
   "name": "La pelle del soldato",
   "date": "25/04/2018 - 03/05/2020",
   "location": "Rovereto"
  },
  {
   "name": "Es war einmal...Hört zu und macht mit!",
   "date": "05/10/2019 - 16/05/2020",
   "location": "Riva del Garda"
  },
  {
   "name": "Storylab",
   "date": "26/10/2019 - 23/05/2020",
   "location": "Riva del Garda"
  }
 ]
}